dataId,region,genre,contentType,title,length,releaseYear,votes,rating,description
49781,United Kingdom,Comedy,movie,National Theatre Live: Fleabag,80.0,2019,2461,8.3,"A rip-roaring look at some sort of woman living her sort of life. With family and friendships under strain and a guinea pig cafe struggling to keep afloat, Fleabag suddenly finds herself with nothing to lose."
49784,India,Drama,movie,Fandry,101.0,2013,2461,8.3,"It is about a teenager from a Dalit (Oppressed caste) family, who lives at the village fringe, and falls in love with an upper caste girl."
49063,United States,Comedy,tvSeries,Game Sack,-1.0,2011,153,8.2,Joe and Dave babble about video games.
49089,Canada,Drama,tvSeries,Je voudrais qu'on m'efface,157.0,2021,152,8.5,"The action is located in a building in a popular neighborhood of Montreal (Canada). Three teenagers, Melissa, Eddy and Karine, live in the same building, but are not friends. From an early ...                 »
"
49099,United States,Comedy,tvSeries,Sanders Sides,-1.0,2016,152,8.4,"Thomas has the ability to project the different aspects of his personality in four different characters. Logic is his logical side, Dad is his moral side, Princey is his creative side, and Anxiety is his fear."
49103,United Kingdom,Drama,tvSeries,A Picture of Katherine Mansfield,50.0,1973,152,8.9,"The life of Katherine Mansfield (Vanessa Redgrave), a prominent writer of the early twentieth century, interwoven with adaptations of some of her best-known short stories."
49112,United States,Drama,tvSeries,The Ginger Tree,240.0,1989,152,8.1,"In 1903, a young Scotswoman goes to join her diplomat fiancé in Manchuria. She marries him, and finds herself in a war zone. Disenchanted with her husband, she falls in love with a married ...                 »
"
49134,Canada,Comedy,tvSeries,This Hour Has Seven Days,60.0,1964,152,8.6,Canada's most famous and controversial news and public affairs show.
49155,United States,Comedy,tvSeries,All That Glitters,30.0,1977,151,8.5,Satirical look at a world where women rule and men are objectified.
49224,United States,Comedy,tvSeries,Monster Factory,25.0,2015,150,9.2,"In this web series, brothers Justin and Griffin McElroy explore the depths of video game character creation tools."
49227,United Kingdom,Comedy,tvSeries,Charity Shop Sue,-1.0,2019,150,8.9,"In 2014, local filmmakers were invited to document the life of charity shop manager Sue Tuke. Sue hoped to prevent the store from closure and become an online superstar. Not all went to plan."
49276,India,Comedy,movie,Bell Bottom,130.0,2019,2511,8.2,Police constable Divakar finally gets a chance to fulfill his childhood dream of becoming a detective when a mysterious robbery takes place at the local police station.
48457,India,Drama,movie,Jayanti,144.0,2021,2584,8.3,"Santya is an aggressive young chap, who is a matter of worry and fear for his family and society. He is good for nothing. However, a murder in the neighborhood poses a serious challenge of identity before him."
48526,United Kingdom,Comedy,movie,Anglian Lives: Alan Partridge,29.0,-1,2571,8.4,Z list celebrity will do anything to become A list
48581,United Kingdom,Drama,tvSeries,Rhodes,-1.0,1996,156,8.0,The story of the British 19th-century businessman who became the wealthiest man in the Western world and founded the nation Rhodesia.
48582,United Kingdom,Drama,tvSeries,An Age of Kings,60.0,1960,156,8.4,A linking together of Shakespeare's history plays chronicling the rise and fall of monarchs over the eighty-six years between Richard II and Richard III.
48632,United Kingdom,Drama,tvSeries,Strange Report,60.0,1969,155,8.4,"Retired Scotland Yard commissioner Adam Strange investigates bizarre mysteries in ""Swinging Sixties"" London."
48646,India,Comedy,tvSeries,Karamchand,-1.0,1985,155,8.7,"One of the first indian detective series. Karamchand and his assistant solve murder, robbery and other mysteries."
48655,United States,Drama,tvSeries,The Man and the City,60.0,1971,155,8.6,Thomas Acala is the longtime mayor of a rapidly growing city in Southwest United States. He handles the constant challenges with the help of his chief aide Andy Hays and secretary Marian Crane.
48682,United States,Comedy,tvSeries,Creature Features,-1.0,2016,154,8.4,"""Creature Features"" see a has-been rock star Vincent Van Dahl hosts horror films in his haunted mansion with the help of his stalwart butler Mr. Livingston and quixotic housemate Tangella."
48753,United States,Comedy,tvSeries,KRFT PUNK'S Political Party!,21.0,2019,154,8.3,"The Eric Andre Shows own Kraft Punk goes to Washington DC to find the answers to all Americas burning questions; and interviews some of DC's most ""popular"" politicians."
48769,United States,Drama,tvSeries,I Led 3 Lives,30.0,1953,153,8.1,"Herbert Philbrick was a young professional and pacifist in 1939 Boston. He joined an anti-war group and quickly found himself caught up in the secret world of underground communist activity...                 »
"
48786,United Kingdom,Comedy,tvSeries,I Didn't Know You Cared,30.0,1975,153,8.0,"The life and times of the Brandon family which is often hilarious. Mr. Brandon (John Comer), Mrs. Brandon (Liz Smith) and Uncle Mort (Robin Bailey) accompanied by Carter Brandon (Stephen ...                 »
"
48790,United States,Drama,tvSeries,The Last Convertible,360.0,1979,153,8.3,"A World War II coming-of-age drama about five men who meet in the fall of 1940 at Harvard. The war affects all of them, each in different ways. A green 1939 Packard convertible is at the ...                 »
"
47912,India,Comedy,movie,Punjabi House,146.0,1998,2645,8.1,A debt-ridden man tries to commit suicide by drowning in the sea but he is rescued by two fishermen and ultimately he ends up working for a Punjabi household.
47983,Japan,Drama,movie,Twenty-Four Eyes,156.0,1954,2632,8.0,"Schoolteacher Hisako Oishi forms an emotional bond with her pupils and teaches them various virtues, while at the same time worrying about their future."
48013,India,Drama,movie,Gitanjali,150.0,1989,2628,8.3,"On a fog swept chilly hill station, a terminally ill young man (Prakash) meets a boisterous girl (gitanjali). Love blossoms, but there's a shadow behind the light she radiates."
48149,United States,Comedy,tvSeries,Austin Stories,23.0,1997,159,8.5,"The story of three friends - Laura, A newspaper columnist, Howard, a homeless slacker, and Chip, a misdirected career-vagabond, - and their misadventures together."
48184,United Kingdom,Drama,tvSeries,Burn It,30.0,2003,158,8.6,"Carl, Jon and Andy have been mates forever. They are Generation X # hardened party animals but their party train is grinding to a halt."
48187,India,Drama,tvSeries,Surya,34.0,2021,158,8.2,"The show follows the story of Surya, a middle-class youngster struggling to find a decent job but to his misfortune, he never achieves any success at the task."
48189,United States,Comedy,tvSeries,Welcome to the Basement,-1.0,2012,158,8.3,"Matt's (Matt Sloan) got a bunch of movies he's never seen before. Craig (Craig Johnson) doesn't know what they are. Every episode Matt's gonna spring one on Craig. It might be good, it ...                See full synopsis »
"
48229,United States,Comedy,tvSeries,InfoMania,-1.0,2007,158,9.1,"A weekly half-hour of comedy and common sense that sorts through the 24-hour, multi-screen media chaos in search of the ridiculous, the funny, and the ridiculously funny."
48239,United Kingdom,Comedy,tvSeries,Jaffa Factory,19.0,2012,158,9.1,"The Yogscast boys Xephos, Honeydew and Lividcoffee is on a quest to create a Jaffa cake factory known as Honeydew Inc in the plains. But little do they know a rival Dirt Factory is opening ...                 »
"
48308,United States,Comedy,tvSeries,Horrible People,6.0,2008,157,8.9,"Add a Plot
"
47406,United Kingdom,Drama,tvSeries,Eureka Street,240.0,1999,163,8.2,"The story of a group of people from Northern Ireland, trying to make their way in life in the face of sectarian and political polarization. Chucky is an overweight 30-year-old who has yet ...                 »
"
47425,Japan,Drama,tvSeries,Raifu,36.0,2007,163,8.1,"Ayumu passes an entrance exam of a high school with help of Yuko, her best friend, but Yuko fails and blames Ayumu for her failure. Broken heart from the broken friendship, Ayumu shuts her ...                 »
"
47666,United States,Comedy,tvSeries,The Soupy Sales Show,30.0,1953,162,8.3,"Saturday morning comedy for all ages brought to you by comic Soupy Sales and his friends Black Tooth, White Fang and Pookie. Largely one-set production relied heavily on cuts to old film ...                 »
"
47719,United States,Comedy,tvSeries,Internet Comment Etiquette,-1.0,2009,162,9.5,Erik teaches the internet how to properly leave comments and have proper etiquette on the internet.
47764,United States,Comedy,tvSeries,The Key of Awesome,-1.0,2009,161,8.4,"The Key of Awesome is a YouTube based comedy show which spoofs everything from pop-culture to the latest Internet memes. However, it is best known for spoofing chart topping songs, such as Ke$ha's 'Tik Tok'."
47775,United Kingdom,Drama,tvSeries,The Glittering Prizes,471.0,1976,161,8.4,"Twenty years in the lives of some Cambridge undergraduates, who all find that the real world of a changing Britain is a hard place."
47784,United Kingdom,Drama,tvSeries,P.O.W.,48.0,2003,161,8.1,"Flight Sergeant James Caddon is captured when his plane is shot down on a bombing raid. He is taken to the P.O.W. camp Stalag 39, where he discovers a daring escape is already being planned."
47796,United Kingdom,Comedy,tvSeries,MTV's Most Wanted,-1.0,1992,161,8.8,"Add a Plot
"
47820,United Kingdom,Drama,tvSeries,Tom Brown's Schooldays,225.0,1971,160,8.1,"Tom Brown, as a new boy at Rugby Public School, has to contend with the school's harsh discipline and accepted bullying from the older boys. Adaptation of Thomas Hughes' novel."
47823,United Kingdom,Drama,tvSeries,The Human Jungle,60.0,1963,160,8.0,This is a British television series in which Dr. Roger Corder (Herbert Lom) is a psychiatrist who is able to treat and cure any patients' mental disorders through Freudian and contemporary approaches.
47838,United States,Drama,tvSeries,Spyder Games,30.0,2001,160,8.0,"Add a Plot
"
47840,United Kingdom,Comedy,tvSeries,Fantasy Football League,30.0,1994,160,8.2,"Add a Plot
"
47842,United Kingdom,Drama,tvSeries,Holding On,55.0,1997,160,8.5,"A complex, moving story of life in the big bad city, in this case London. The tragic, senseless, futile murder of a beautiful young woman, just embarking on her journey through life, acts ...                 »
"
47852,United States,Comedy,tvSeries,Late World with Zach,30.0,2002,160,8.1,"A short-lived talk show that aired in the Spring of 2002 featuring topical humor, skits, celebrity guests, and musical performances."
46912,India,Drama,movie,Shubh Nikah,-1.0,2023,2767,10.0,"Families of two different cultures join hands and come together for love, humanity, and peace with a strong message of national integrity"
46934,United States,Comedy,tvSeries,The Brendan Leonard Show,30.0,2003,167,8.6,"Brendan Leonard's Chicago cable access show makes it to cable. He and his friends will make you laugh with their humor, silliness, and daring but hilarious ideas."
46935,United States,Drama,tvSeries,Front Seat Chronicles,5.0,2012,167,8.6,"Add a Plot
"
46955,India,Drama,tvSeries,Karmaphal Daata Shani,-1.0,2016,166,8.6,"The story of the series is based on the life of God Shani, who is known for his wrath. The serial also shows Vishnu and Shiva as Shani's mentors. It also shows Shani's tough childhood, ...                 »
"
47012,India,Drama,movie,"Sarkari. Hi. Pra. Shale Kasaragodu, Koduge: Ramanna Rai",147.0,2018,2739,8.7,The happy and mischief-filled lives of the children of a Kannada medium school in Kerala are brought to a halt when the government decided to close the school.
47088,India,Drama,movie,Bharatham,147.0,1991,2722,8.4,"The tale of two classical musician brothers: while the elder squanders his life and talent away, the younger one fulfills their joint responsibilities towards their family."
47208,United States,Comedy,tvSeries,Comedy Underground with Dave Attell,30.0,2014,166,8.0,"Stand-up legend Dave Attell hosts, joined by old friends as well as some new faces in their rawest, unfiltered state in New York's historic Village Underground. Each episode features sets from three comics."
47226,United Kingdom,Drama,tvSeries,The Inside Man,-1.0,2019,165,8.1,"Meet Mark, a man with secrets. This lonely hacker must blag his way into Khromacom's security team and destroy the company. His new colleagues present a heartbreaking dilemma: satisfy his sinister controller or betray his loveable friends?"
47236,United Kingdom,Drama,tvSeries,BBC Sunday-Night Theatre,-1.0,1950,165,8.2,Series of television plays performed live.
47269,India,Comedy,tvSeries,Roomies in Dreamland,-1.0,2023,165,8.3,"Roomies come to Mumbai looking to launch their careers in Bollywood. As story progresses, the Roomies get acquainted with Robin, a 90's film star whose career is on the verge of dying, who will go to any means to relive his glory days."
47289,United States,Drama,tvSeries,AboveGround,19.0,2014,165,8.3,"AboveGround is a dramatic anthology series that revolves around Hot Music Producer, Bill T. (Darren Anthony Thomas) and his ultimate quest to find the best Independent Musical Artist that ...                 »
"
47304,India,Comedy,tvSeries,"Kya Haal, Mr. Paanchal?",20.0,2017,164,8.1,"Kunti Devi is looking for a perfect bride for her son. When God finally grants her wish, it's five daughters-in-law she has to deal with."
47309,United States,Drama,tvSeries,Medic,30.0,1954,164,8.2,"Highlights the personal and professional lives of a group of doctors and surgeons headed by Dr. Konrad Styner. One of the first medical shows on TV that paid strict attention to detail, and...                 »
"
47319,India,Drama,tvSeries,Kotha Poradu,22.0,2020,164,8.1,"This story revolves around Raju, a care-free village guy who is new to the city. While his struggle seems to be never-ending, fate has a different plan in store for him. Watch Kothaporadu and know more about his journey."
47339,United States,Comedy,tvSeries,All Star Revue,60.0,1950,164,8.3,"This early comedy program started off with a rotating cast of four famous comedians, each of whom would take turns hosting the show. The program format was similar to that of a Vaudeville ...                 »
"
47384,United Kingdom,Drama,tvSeries,The Roads to Freedom,559.0,1970,163,8.4,Dramatisation of Jean-Paul Sartre's trilogy.
47394,India,Drama,tvSeries,Yeh Kahan Aa Gaye Hum,20.0,2015,163,8.2,"The show revolves around the unusual love stories of two contrasting opposite persons. Things do not remain the same when Rahul, a Rock-star and the scion of the biggest musical empire runs...                 »
"
46419,India,Comedy,tvSeries,Akbar Birbal,25.0,2014,170,8.1,"The well known folklore characters, Akbar and Birbal have been extremely popular with the kids for their combined wit and wisdom. The show is a fresh, comic take on the relation between ...                 »
"
46472,United States,Comedy,tvSeries,The Meeting,78.0,2013,170,8.6,"Budding screenwriters attend various writer workshops where they don't learn anything.. guest speakers include a clown, a homeless man and a female porn star."
46474,Japan,Drama,tvSeries,Kita no kuni kara,45.0,1981,170,8.2,"""From the North"" with warmth loving strokes, describing the love of family, love of humanity. Because his wife was having an affair and divorce, Kuroita Goro, with a son and daughter from ...                 »
"
46564,India,Drama,movie,Aranyer Din Ratri,115.0,1970,2778,8.1,"A group of Calcutta city slickers, including the well-off Asim (Soumitra Chatterjee), the meek Sanjoy (Subhendu Chatterjee) and the brutish Hari (Samit Bhanja), head out for a weekend in the wilderness."
46648,India,Drama,movie,Thithi,123.0,2015,2761,8.1,"In a South Indian village, a centenarian's funeral brings together his free-spirited son, inheritance-hungry grandson and girl-crazy great-grandson."
46761,United States,Comedy,tvSeries,Jablinski Games,-1.0,2018,169,8.6,Jack Black plays video games with a vlog-like twist.
46805,United States,Comedy,tvSeries,The People's Choice,30.0,1955,168,8.1,"Socrates ""Sock"" Miller joins the city council, clashing with the mayor John Peoples. Sock dates then marries his daughter Mandy complicating things. Sock has a basset named Cleo who shares her thoughts and best friend Rollo."
46880,United States,Comedy,tvSeries,Submissions Only,-1.0,2010,167,8.9,"Penny Reilly is a reader for Broadway casting director Tim Trull attempting to become an actress herself. Throughout the web-series, we follow the misadventures of Penny and her love life."
45920,Canada,Drama,tvSeries,Ruby and the Well,44.0,2022,174,8.0,"When her father inherits an overgrown orchard, Ruby O'Reilly discovers a magic well. She's been designated its new ""keeper,"" and now it's up to her and her friends Mina and Sam to turn unfulfilled wishes into reality."
45926,United Kingdom,Comedy,tvSeries,Cardiac Arrest,30.0,1994,174,8.1,"Comedy set in and around a hospital, where the newly qualified Dr Andrew Collin is thrown into a world that is totally beyond him."
45938,United Kingdom,Comedy,tvSeries,Train Guy,1.0,2019,174,9.7,"A commuter's video conversations with work colleagues documenting the details of business, banter and life in the 21st century."
46209,India,Drama,movie,Belaseshe,141.0,2015,2797,8.5,"A story of relationships that explores the intricacies of the married life, of life-long companionship, of promises and expectations and love."
46250,United States,Comedy,tvSeries,The United States Steel Hour,60.0,1953,173,8.2,"In this live drama series, over two hundred live plays, covering all aspects of society, were shown."
46309,United Kingdom,Comedy,tvSeries,Brass,30.0,1983,172,8.1,"This spoof of soap-operas was set around two feuding families, the wealthy Hardacres headed by the ruthless capitalist Bradley Hardacre and the poor, working-class Fairchilds headed by the stern socialist Jack Fairchild."
46321,United States,Drama,tvSeries,Mister Sterling,60.0,2003,172,8.0,"The scandal-free son of a former Governor of California is appointed to be Senator, whereupon it's discovered he's an independent. Modern day Mr. Smith Goes to Washington"
46324,United Kingdom,Comedy,tvSeries,Joking Apart,30.0,1991,172,8.4,A comedy writer talks about his failed marriage.
45416,Canada,Drama,tvSeries,Grande ourse,600.0,2003,179,8.5,"Journaliste vedette de l'information télévisée, Louis-Bernard Lapointe a vu sa brillante carrière péricliter à cause de son penchant pour la dive bouteille. Il a perdu le feu sacré et c'est...                 »
"
45488,India,Drama,tvSeries,Dhadkan Zindaggi Kii,-1.0,2021,177,8.7,"In a world where rules are set by men, Dr Deepika Sinha, a surgeon, enters FMS hospital. But for her to live her dream, she must struggle against gender bias, judgment, as well as her own past."
45508,India,Drama,movie,Mr. King,-1.0,2023,2888,9.1,Shiva is an RJ who is doing his thesis on airplane mechanism while Seetharama is cunning and complex. Umadevi and Vennela both fell in love with Shiva. How will Shiva untangle the love triangle and manage Seetharama Raju's twisted game?
45669,India,Comedy,movie,The Kingdom of Diamonds,118.0,1980,2860,8.9,The musical duo of Goopi and Bagha make a comeback when they are invited to play for a king.
45733,India,Drama,movie,Guna,167.0,1991,2844,8.2,A neurodivergent individual escapes the family he despises and the asylum he is kept in by creating fantasies.
45830,United States,Comedy,tvSeries,Impress Me,-1.0,2015,176,8.0,Two impressionists start a 12-step program to stop doing impressions and transition into dramatic acting.
45839,United States,Comedy,tvSeries,Alantutorial,-1.0,2011,176,8.5,"Alan is a man who loves making YouTube tutorials, simple as that. But the more videos he makes, the more dark secrets are revealed in this highly acclaimed webseries."
45840,United States,Comedy,tvSeries,"No, You Shut Up!",30.0,2013,176,8.0,Paul F. Tompkins and a panel of four puppets discuss the topics of the day until they get too angry to discuss them any further.
45857,India,Drama,tvSeries,Bravehearts,-1.0,2022,175,9.1,"Bravehearts is India's first Army anthology series dedicated to the humans behind the heroes in our Army. The series explores 5 unique stories of hope, courage, sacrifice, and pride for our nation."
45877,United Kingdom,Drama,tvSeries,Tender Is the Night,180.0,1985,175,8.2,"F. Scott Fitzgerald's novel about how the rich languoring on the Riviera in the 1920's are slowly drawn into the coming depression is once again filmed with Peter Strauss, Mary Steenburgen,...                 »
"
45889,India,Comedy,tvSeries,Life Lafde Aur Bandiyan,22.0,2016,175,8.5,"Three 20 year olds - Rishabh, Puppy and Chewang vow to make legends of themselves on their campus, after being humiliated for being total losers."
45899,Japan,Comedy,tvSeries,Mahoro ekimae bangaichi,-1.0,2013,175,8.0,"Tada Keisuke and Gyoten Haruhiko are two friends who work as ""Benri-ya"" (Handymen, Jack of all trades) in a fictional city called Mahoro in Japan. The story is different between each ...                 »
"
44961,Japan,Drama,tvSeries,Iryû: Team Medical Dragon,-1.0,2006,182,8.2,"Ryutaro Asada, a renegade but brilliant surgeon, was being framed for a misdiagnosis and let go by the North Japanese Hospital. He went into exile and lived in a seaside shack when he was ...                 »
"
45088,India,Comedy,movie,Pattanapravesam,158.0,1988,2923,8.2,"CID Officers Ramdas and Vijayan go to Kerala to find the murderer of a police officer. While doing so, they face a dangerous crime syndicate that deals in drug trafficking."
45104,United Kingdom,Comedy,movie,Rowan Atkinson Live,55.0,-1,2920,8.3,"Rowan Atkinson and Angus Deayton in Boston doing a live performance of the same styles of humor we've seen in Mr. Bean and Blackadder. Included are lessons on Shakespearean acting, a school...                 »
"
45131,India,Drama,movie,Aandavan Kattalai,151.0,2016,2914,8.1,Gandhi and Pandi decided to get a passport and travel to London to get rid of debts in their village. Things didn't happened has they planned.
45276,India,Drama,tvSeries,Thipkyanchi Rangoli,30.0,2021,181,8.3,"Shashank, a scholar from a middle-class joint family, meets free-spirited and sophisticated Apurva. What will happen when these two opposites collide?"
45282,United Kingdom,Comedy,tvSeries,Jack and Dean of All Trades,11.0,2016,181,8.1,"Fresh out of university, childhood best friends Jack and Dean sign up with a London temp agency that places them in various jobs--some mundane, some a bit weird--but it's guaranteed that nothing with these two ever goes as planned."
45320,United Kingdom,Drama,tvSeries,The Children of Green Knowe,100.0,1986,180,8.5,"A young boy goes to live with his great-grandmother. While she tells him stories of his ancestors, he begins to see the spirits of children who lived in the house during the reign of Charles II."
45365,United States,Comedy,tvSeries,Dr. Wareheim,4.0,2013,180,8.1,Mr. Heidecker checks in with Dr. Wareheim.
45382,United States,Comedy,tvSeries,Play by Play,-1.0,2017,179,8.0,A coming of age comedy about an ESPN sportscaster who looks back on his life in the 90s and gives the play-by-play of his adolescence.
44469,United Kingdom,Comedy,tvSeries,Flickers,50.0,1980,186,8.1,"Arnie and Maud Cole are a very odd couple. She wanted a father for her unborn child, he needed the money middle-class Maud could provide. Together they negotiate the rough and tumble world ...                 »
"
44474,United Kingdom,Comedy,tvSeries,Help,30.0,2005,186,8.3,A psychiatrist who helps various people
44516,India,Drama,movie,Love Today,151.0,1997,2988,8.7,"Ganesh is obsessively in love with Sandhya, but she is not interested in him. His relentless pursuit leads to a lot of problems. However, everything changes the day he loses his father in an accident."
44606,India,Drama,movie,Ayalum Njanum Thammil...,160.0,2012,2969,8.0,"A story on how a brilliant and dedicated senior doctor molds an irresponsible amateur doctor into one much like him, and how a forbidden relationship comes in between."
44735,India,Drama,movie,Thaniyavartanam,119.0,1987,2941,8.8,"A school teacher living in a village belongs to a family with a history of lunatic males, and soon he falls prey despite being normal due to society misinterpreting his actions."
44757,United States,Drama,tvSeries,East Side/West Side,60.0,1963,185,8.8,"In this weekly drama show, George C. Scott plays a dedicated, idealistic yet practical, compassionate social worker trying to solve the problems of his clients in the fascinating mix of cultures that makes up New York City."
44765,United States,Comedy,tvSeries,Friday Night Tights,-1.0,2018,185,8.1,"On Friday nights, a panel of famous and infamous YouTubers discuss and dissect all forms of entertainment."
44773,United Kingdom,Drama,tvSeries,Civvies,55.0,1992,185,8.0,Former soldiers in Britain's elite Parachute Regiment struggle to come to terms with civilian life after leaving the army.
44810,United States,Drama,tvSeries,Coronet Blue,60.0,1967,184,8.4,"Michael Alden is an amnesiac, who must discover his real identity before the operatives of a mysterious group locate him and kill him. The key to his past might be ""Coronet Blue"", a meaningless phrase he for some reason remembers."
44894,United States,Comedy,tvSeries,Son of Svengoolie,120.0,1978,183,8.2,"Weekly Television show that originally aired on WFLD 32 in the Chicago area (and originally went by the name ""Son of Svengoolie"", having been spun off of the original series ""Screaming ...                 »
"
