dataId,region,genre,contentType,title,length,releaseYear,votes,rating,description
8348,United Kingdom,Comedy,tvSeries,The Good Life,28.0,1975,3688,8.0,"Tom Good quits the rat race, and with wife Barbara turns the garden of their Surbiton house into a smallholding. Their neighbours, snobbish Margo Leadbetter and her conventional husband Jerry, feel variously amused, offended and impressed."
8364,India,Comedy,tvSeries,Hey Prabhu!,22.0,2019,3671,8.4,"The show revolves around the millennial's and what they go through in their everyday lives. ""Hey Prabhu"" is the story of a common man Tarun Prabhu and his unbelievable journey."
8388,United Kingdom,Comedy,tvSeries,The No. 1 Ladies' Detective Agency,60.0,2008,3637,8.2,A woman opens her own detective agency in Botswana.
8402,United States,Comedy,tvSeries,Detroiters,21.0,2017,3613,8.1,"Single camera, buddy comedy that centers on Sam (Richardson) and Tim (Robinson), two local ad men who make low budget commercials in Detroit, Michigan. But the two best friends, much like the city in which they live, aspire to achieve great things."
8473,United States,Comedy,tvSeries,Best of the Worst,-1.0,2013,3522,9.4,"Mike, Jay, Rich and the rest of the Red Letter Media crew brave some of the worst movies ever created by man."
7487,United Kingdom,Comedy,tvSeries,Nathan Barley,26.0,2005,4219,8.0,"After publishing a rant about 'idiots' - frantically hip, ignorant scenesters - Dan Ashcroft finds these same people embracing him as his idol and his nerves constantly tested by his biggest fan, moronic scene personality Nathan Barley."
7498,United Kingdom,Comedy,tvSeries,This Time with Alan Partridge,30.0,2019,4196,8.0,"Alan is handed a career lifeline: the chance to stand in (temporarily) as co-host on This Time, a weekday magazine show. But can he capitalize on the opportunity?"
7503,Japan,Drama,movie,Throne of Blood,110.0,1957,53384,8.1,"A war-hardened general, egged on by his ambitious wife, works to fulfill a prophecy that he would become lord of Spider's Web Castle."
7518,Japan,Drama,movie,Departures,130.0,2008,53011,8.0,A newly unemployed cellist takes a job preparing the dead for funerals.
7562,United States,Drama,movie,Sunrise,94.0,1927,51917,8.1,"A sophisticated urban woman seduces a farmer in the hopes that he will murder his neglected wife and join her in the city, but he ends up rekindling his romance with his wife when she discovers their scheme."
7575,India,Drama,movie,Tumbbad,104.0,2018,51711,8.2,A mythological story about a goddess who created the entire universe. The plot revolves around the consequences when humans build a temple for her first-born.
7689,United States,Drama,movie,The Last Picture Show,118.0,1971,49549,8.0,"In 1951, a group of high schoolers come of age in a bleak, isolated, atrophied North Texas town that is slowly dying, both culturally and economically."
7713,United States,Comedy,movie,Paper Moon,102.0,1973,49199,8.1,"During the Great Depression, a con man finds himself saddled with a young girl who may or may not be his daughter, and the two forge an unlikely partnership."
7761,Canada,Comedy,tvSeries,Your Movie Sucks,-1.0,2010,4170,8.7,Internet series in which host and creator Adam critiques a movie.
7804,United Kingdom,Drama,tvSeries,Home Fires,45.0,2015,4089,8.2,A drama following a group of inspirational women in a rural Cheshire community during World War II.
7839,United States,Comedy,tvSeries,Zach Stone Is Gonna Be Famous,21.0,2013,4036,8.3,"After recently graduating high school, young Zach Stone opts out of a college to pursue the New American Dream: becoming famous with no talent whatsoever."
7842,India,Drama,tvSeries,Malgudi Days,-1.0,1986,4027,9.4,"Based on the works of R.K. Narayan, Malgudi Days chronicles the lives of people living in the fictitious town of Malgudi."
7843,United States,Comedy,tvSeries,The Tonight Show Starring Johnny Carson,105.0,1962,4021,8.5,Host Johnny Carson performs comedy routines and chats with various celebrities.
7846,India,Drama,tvSeries,Laakhon Mein Ek,30.0,2017,4009,8.2,Dr. Shreya is posted in Sitlapur village to conduct a cataract camp but challenges begin unfolding one after the other. She keeps fighting the system but the question remains whether she will change the system or the system will change her?
7858,India,Comedy,tvSeries,Bhabi Ji Ghar Par Hai,22.0,2015,3996,8.7,Loveless marriages and jealousy characterize two neighboring households as they try to cope with each other and themselves.
7864,United Kingdom,Comedy,tvSeries,James Acaster: Repertoire,205.0,2018,3990,8.4,James Acaster presents four interwoven stand-up comedy specials.
7890,United Kingdom,Comedy,tvSeries,Penn & Teller: Fool Us,60.0,2011,3953,8.0,"Aspiring magicians from all over the world perform their best tricks to try and fool Penn and Teller, the world-famous magician duo. If the two can not guess how the trick was done, the ""fooler"" gets to be on their Las Vegas magic show."
7908,Canada,Comedy,tvSeries,Todd and the Book of Pure Evil,-1.0,2010,3926,8.2,"A stoner metalhead named Todd Smith, his crushee Jenny, his best friend Curtis, and the geeky Hannah, search their high school for a mayhem-causing Satanic spell book, while being opposed by Atticus, the evil guidance councillor."
7924,United States,Comedy,tvSeries,Stella,30.0,2005,3907,8.1,"A sketch comedy show that follows the absurd adventures of Michael, Michael and David."
7948,India,Drama,tvSeries,Ghar Waapsi,41.0,2022,3872,8.8,"The life of Shekhar, who is out of work, changes forever as he moves back to his hometown and finds a road to self-discovery."
7963,India,Comedy,tvSeries,TVF Bachelors,-1.0,2016,3855,8.2,The series revolves around Four Bachelor Flatmates who in every episode will deal with a specific daily life bachelor related problem. Its about their battle against an external X problem as a single team The Bachelors.
7978,United States,Comedy,tvSeries,As We See It,35.0,2022,3828,8.1,Three autistic roommates find a way to live together and strive for similar things in life.
6997,United Kingdom,Comedy,tvSeries,As Time Goes By,60.0,1992,4597,8.3,"The Korean War, and a long lost letter, separate the lives of young lovers Jean Pargetter and Lionel Hardcastle, whose paths cross again by happenstance."
7009,United States,Drama,movie,What Ever Happened to Baby Jane?,134.0,1962,58088,8.0,A former child star torments her paraplegic sister in their decaying Hollywood mansion.
7083,India,Comedy,movie,Chhichhore,143.0,2019,56823,8.3,"A tragic incident forces Anirudh, a middle-aged man, to take a trip down memory lane and reminisce his college days along with his friends, who were labelled as losers."
7086,United States,Comedy,movie,Stalag 17,120.0,1953,56765,8.0,"After two Americans are killed while escaping from a German P.O.W. camp in World War II, the barracks black marketeer, J.J. Sefton, is suspected of being an informer."
7263,United States,Comedy,tvSeries,Sprung,35.0,2022,4575,8.3,"Having been previously incarcerated, Jack moves in with his former cellmate, Rooster, and is determined to turn his life around, just at the start of a global pandemic."
7274,United Kingdom,Comedy,tvSeries,Cold Feet,45.0,1997,4553,8.2,"The show follows the lives of 30-something couples Adam and Rachel, Pete and Jenny, and David and Karen as they navigate love and life in Manchester."
7276,United Kingdom,Drama,tvSeries,The Singing Detective,415.0,1986,4552,8.6,"Tormented and bedridden by a debilitating disease, a mystery writer relives his detective stories through his imagination and hallucinations."
7326,Japan,Drama,tvSeries,Midnight Diner: Tokyo Stories,24.0,2016,4460,8.4,An anthology of human relationship stories connected by the only open in the wee hours diner the characters frequent. Resolutions are often facilitated by the owner/chef.
7368,United Kingdom,Drama,tvSeries,Smiley's People,60.0,1982,4403,8.5,"The murder of a Soviet defector forces his old handler, British spymaster George Smiley, out of retirement. His investigation leads to an old nemesis, the Soviet spymaster known only as ""Karla"". This will be their final dance."
7375,United States,Comedy,tvSeries,Men of a Certain Age,60.0,2009,4389,8.0,A group of college buddies in the throes of middle age keep their friendship going long after they've graduated.
7403,United Kingdom,Comedy,tvSeries,We Are Lady Parts,24.0,2021,4342,8.2,"A look at the highs and lows of the band members that make up a Muslim female punk band, Lady Parts, as seen through the eyes of Amina Hussein, a geeky PhD student who is recruited to be their unlikely lead guitarist."
7409,United Kingdom,Drama,tvSeries,To Play the King,218.0,1993,4334,8.3,"Francis Urquhart, the unscrupulous but cunning Conservative Prime Minister, has his survival threatened by a liberal monarch and an upcoming General Election."
7424,United Kingdom,Comedy,tvSeries,The Young Offenders,30.0,2018,4314,8.0,"Coming-of-age drama about lovable rogues Conor and Jock as they navigate their awkward teenage years, hatching plans and adventures to help distract from their tough home lives and their inability to stay out of trouble at school."
7464,India,Drama,tvSeries,Tabbar,-1.0,2021,4257,8.3,The show charts the journey of a retired police constable who pushes the boundaries to save his family from the consequences of an unfortunate incident.
6111,United States,Drama,movie,Anatomy of a Murder,161.0,1959,67814,8.0,"An upstate Michigan lawyer defends a soldier who claims he killed an innkeeper due to temporary insanity after the victim raped his wife. What is the truth, and will he win his case?"
6159,United States,Drama,movie,The Best Years of Our Lives,170.0,1946,66360,8.1,"Three World War II veterans, two of them traumatized or disabled, return home to the American midwest to discover that they and their families have been irreparably changed."
6230,United States,Drama,movie,Rio Bravo,141.0,1959,64228,8.0,"A small-town sheriff in the American West enlists the help of a disabled man, a drunk, and a young gunfighter in his efforts to hold in jail the brother of the local bad guy."
6289,United States,Comedy,tvSeries,Middleditch & Schwartz,51.0,2020,5636,8.6,"Thomas Middleditch (""Silicon Valley"") and Ben Schwartz (""Parks and Recreation"") perform two-person long-form improv."
6303,India,Comedy,tvSeries,Comedy Nights with Kapil,60.0,2013,5606,8.0,Every episode starts with stage act of Kapil Sharma and various characters and then Kapil take one or more celebrity interview with co-actors.
6339,India,Drama,tvSeries,Kuch Rang Pyar Ke Aise Bhi,22.0,2016,5518,8.3,"Kuch Rang Pyar Ke Aise Bhi is a mature love story of Devrath Dixit, a successful business tycoon and Dr. Sonakshi Bose, a nutritionist."
6380,United Kingdom,Comedy,tvSeries,Horrible Histories,28.0,2009,5413,8.8,"A group of British comedians show the sides of history they don't teach you in school. From the 'Savage Stone Age' to the 'Troublesome 20th Century', you see the full side to history."
6399,United States,Comedy,tvSeries,The Whitest Kids U'Know,15.0,2007,5370,8.5,A sketch comedy show involving five friends.
6400,United Kingdom,Comedy,tvSeries,The Day Today,30.0,1994,5370,8.6,"A spoof of the British style of news broadcasting - including ridiculous stories, patronising vox pops, offensively hard-hitting research and a sports presenter clearly struggling for metaphors."
6444,United States,Drama,tvSeries,Banshee Origins,-1.0,2013,5285,8.6,"Fresh out of prison after 15 years, a master thief assumes the identity of a dead sheriff in Banshee, PA. After tracking down the woman he loves they try to avoid detection from her father; a Ukrainian mobster looking to kill them for double crossing him."
6456,United Kingdom,Drama,tvSeries,Silk,60.0,2011,5244,8.0,"Drama series about life at the Bar, the dilemmas and problems that modern day barristers have to face, and what it means to become a silk."
6458,United Kingdom,Comedy,tvSeries,Car Share,30.0,2015,5240,8.3,Assistant manager John Redmond and promotions rep Kayleigh Kitson are forced to commute together every day. But will they get along?
6463,India,Comedy,tvSeries,Jugaadistan,40.0,2022,5231,8.4,"A college life drama focusing on the gritty side of campus life, Politics, Love and Emotions."
6485,United States,Drama,tvSeries,Holocaust,475.0,1978,5188,8.0,The saga of a Jewish family's struggle to survive the horror of Nazi Germany's systematic marginalization and extermination of their community.
6517,Japan,Drama,movie,Tokyo Story,136.0,1953,63306,8.2,"An old couple visit their children and grandchildren in the city, but receive little attention."
6642,India,Comedy,movie,OMG: Oh My God!,125.0,2012,60236,8.1,A shopkeeper takes God to court when his shop is destroyed by an earthquake.
6729,Canada,Drama,movie,Mommy,139.0,2014,58624,8.0,"A widowed single mother, raising her violent son alone, finds new hope when a mysterious neighbor inserts herself into their household."
6762,India,Drama,tvSeries,Minus One: New Chapter,32.0,2023,5107,8.5,"Varun and Ria realise that they still might have feelings for each other, when Varun decides to take the big step of marriage with Anisha. As they deal with their repressed feelings, we also see how they fell in love and why they broke up."
6826,United States,Comedy,tvSeries,Half in the Bag,40.0,2011,4947,9.3,"Two VCR repairmen, Mike and Jay, scam an elderly man out of his fortune by discussing movies while on the job, and occasionally go on eccentric misadventures."
6829,United Kingdom,Comedy,tvSeries,The Fast Show,30.0,1994,4933,8.2,UK comedy sketch show depicting most forms of stereotypical British society.
6855,United States,Comedy,tvSeries,Kitchen Confidential,22.0,2005,4894,8.0,A bad-boy chef runs wild in his New York City eatery.
6859,United States,Comedy,tvSeries,Surviving Jack,30.0,2014,4881,8.3,"A boy becomes a man, and a man becomes a father, in a time before coming of age was something you could Google."
6871,United States,Drama,tvSeries,The Booth at the End,30.0,2011,4844,8.2,"Everyone wants something. There is a mysterious figure who sits in the booth at the end, who you make a deal with to get what you want. You do the task or you don't - that is up to you, but...                 »
"
6901,United States,Comedy,tvSeries,St. Elsewhere,60.0,1982,4771,8.0,"The lives and work of the staff of St. Eligius Hospital, an old and disrespected Boston teaching hospital."
6926,United States,Comedy,tvSeries,Pee-wee's Playhouse,30.0,1986,4721,8.1,"Pee-Wee Herman and his friends have wacky, imaginative fun in his unique playhouse."
6970,United States,Comedy,tvSeries,Honest Trailers,5.0,2012,4652,8.5,"In this web series the Screen Junkies crew picks out everything that is wrong with a movie and then makes an ""honest trailer""."
6975,United States,Drama,tvSeries,American Gothic,60.0,1995,4644,8.1,"A quiet, seemingly-quaint small town is ruled over by its charming yet evil sheriff who uses his demonic powers to remove anyone who dares to stand in his way. The only one he fears is a young boy he fathered through rape."
5127,India,Comedy,movie,Munna Bhai M.B.B.S.,156.0,2003,83880,8.1,A gangster sets out to fulfill his father's dream of becoming a doctor.
5135,United States,Drama,movie,The Hustler,134.0,1961,83637,8.0,An up-and-coming pool player plays a long-time champion in a single high-stakes match.
5142,India,Comedy,movie,Barfi!,151.0,2012,83472,8.1,Three young people learn that love can neither be defined nor contained by society's definition of normal and abnormal.
5177,United Kingdom,Drama,movie,Pink Floyd: The Wall,95.0,1982,82417,8.0,A confined but troubled rock star descends into madness in the midst of his physical and social isolation from everyone.
5190,India,Drama,movie,Let's Go! India,153.0,2007,81806,8.1,"Kabir Khan, the coach of the Indian Women's National Hockey Team, dreams of making his all-girls team emerge victorious against all odds."
5224,Japan,Drama,movie,Ikiru,143.0,1952,80613,8.3,A bureaucrat tries to find meaning in his life after he discovers he has terminal cancer.
5228,India,Comedy,movie,Zindagi Na Milegi Dobara,155.0,2011,80460,8.2,Three friends decide to turn their fantasy vacation into reality after one of their friends gets engaged.
5270,United States,Comedy,tvSeries,The Comeback,30.0,2005,7378,8.0,An ex A-list celebrity attempts to rekindle the flame of her once prominent acting career with nothing but a camera crew and some determination.
5284,United Kingdom,Comedy,tvSeries,People Just Do Nothing,30.0,2014,7327,8.5,A mockumentary series about a group of failed MCs from West London and their passion for pirate radio.
5287,United States,Drama,tvSeries,Heels,60.0,2021,7302,8.0,"Two brothers and rivals - one a villain, or ""heel,"" in the ring; the other a hero, or ""face,"" war over their late father's wrestling promotion, vying for national attention in small-town Georgia."
5290,United Kingdom,Comedy,tvSeries,Staged,22.0,2020,7279,8.5,"David Tennant and Michael Sheen star as two actors whose West End play has been put on hold due to Covid-19, but whose director has persuaded them to carry on rehearsing online."
5300,United States,Comedy,tvSeries,Documentary Now!,23.0,2015,7246,8.1,"""Documentary Now!"" parodies the current obsession with documentaries. Season one features six different stories and stylistic approaches paying tribute to the doc format."
5324,India,Comedy,tvSeries,Humorously Yours,-1.0,2016,7159,8.5,"Follows the life of Vipul Goyal , a Stand Up comedian. As the tagline says ""The drama behind the comedy"""
5333,United Kingdom,Drama,tvSeries,Wives and Daughters,301.0,1999,7121,8.1,"The daughter of a country doctor copes with an unwanted stepmother, an impetuous stepsister, burdensome secrets, the town gossips, and the tug on her own heartstrings for a man who thinks of her only as a friend."
5338,India,Comedy,tvSeries,Little Things,16.0,2016,7097,8.2,"A cohabiting couple in their 20s navigate the ups and downs of work, modern-day relationships and finding themselves in contemporary Mumbai."
5353,United Kingdom,Comedy,tvSeries,Phoenix Nights,25.0,2001,7050,8.6,The misadventures of club owner Brian Potter who is determined to make The Phoenix Club the best working men's club in Greater Manchester.
5389,India,Drama,tvSeries,Paava Kadhaigal,36.0,2020,6905,8.0,"At times dark, at times disturbing, four short films explore stories of those who dare to dream and desire - and those determined to stand in their way."
5401,United Kingdom,Drama,tvSeries,The Hollow Crown,150.0,2012,6847,8.2,"A mini-series of adaptations of Shakespeare's history plays: Richard II, Henry IV: Parts 1 and 2, and Henry V."
5411,United Kingdom,Comedy,tvSeries,This Country,21.0,2017,6805,8.5,"Comedy exploring the lives of young people in modern rural Britain, focusing on cousins Kerry and Kurtan's lives in the Cotswolds."
5418,United Kingdom,Comedy,tvSeries,Dad's Army,30.0,1968,6771,8.1,A ragtag group of Home Guard volunteers prepare for an imminent German invasion during World War II.
5433,India,Comedy,tvSeries,Humble Politiciann Nograj,32.0,2022,6711,8.1,"5 years after Humble Politician Nograj becomes a MLA, he aims higher-Chief Minister. Nograj has to spin a new web to get the ultimate seat with twists and turns of Resort Politics, Floor Test, Power Play, Big Boss feels and Russian Mafia."
5436,United Kingdom,Comedy,tvSeries,"Knowing Me, Knowing You with Alan Partridge",45.0,1994,6694,8.2,Alan Partridge hosts his own chat show on the BBC. He insults and belittles almost all of his guests and is humiliated by the rest.
5452,United States,Comedy,tvSeries,Check It Out! with Dr. Steve Brule,11.0,2010,6633,8.6,"See Dr. Steve learn about restaurants, spend time with his family, conquer his fears, and more. Featuring guest appearances by Jan Skylar, Wayne Skylar, and David Liebe Hart."
5455,United States,Comedy,tvSeries,The Carol Burnett Show,60.0,1967,6628,8.7,Television show featuring skits by Carol Burnett and her comedy troupe.
5479,United States,Comedy,tvSeries,Barney Miller,30.0,1975,6554,8.3,The Captain of the NYPD 12th Precinct and his staff handle the various local troubles and characters that come into the squad room.
5518,United States,Drama,movie,Judgment at Nuremberg,179.0,1961,78965,8.3,"In 1948, an American court in occupied Germany tries four Nazis judged for war crimes."
5547,United States,Drama,movie,The Man Who Shot Liberty Valance,123.0,1962,78190,8.1,A senator returns to a Western town for the funeral of an old friend and tells the story of his origins.
5589,United States,Drama,movie,Who's Afraid of Virginia Woolf?,131.0,1966,76832,8.0,"A bitter, aging couple, with the help of alcohol, use their young houseguests to fuel anguish and emotional pain towards each other over the course of a distressing night."
5665,United States,Comedy,movie,Being There,130.0,1979,74235,8.0,"After the death of his employer forces him out of the only home he's ever known, a simpleminded, sheltered gardener becomes an unlikely trusted advisor to a powerful tycoon and an insider in Washington politics."
5690,India,Comedy,movie,Dil Chahta Hai,183.0,2001,73392,8.1,"Three inseparable childhood friends are just out of college. Nothing comes between them - until they each fall in love, and their wildly different approaches to relationships creates tension."
5722,India,Drama,movie,Dilwale Dulhania Le Jayenge,181.0,1995,72297,8.0,"When Raj meets Simran in Europe, it isn't love at first sight but when Simran moves to India for an arranged marriage, love makes its presence felt."
5767,India,Drama,tvSeries,B.E. Rojgaar,35.0,2022,6429,9.0,"An aspirational tale of three engineer friends, Akshay, Piyu and Papdya, who go on a journey from being 'be rojgaar' to creating 'rojgaar' by stumbling on a start-up idea and going back to their roots."
5770,United Kingdom,Comedy,tvSeries,Porridge,45.0,1974,6424,8.3,"The prison life of Fletcher, a criminal serving a five-year sentence, as he strives to bide his time, keep his record clean, and refuses to be ground down by the prison system."
5788,United Kingdom,Comedy,tvSeries,Moone Boy,23.0,2012,6366,8.1,Martin Moone is a young boy who relies on the help of his imaginary friend Sean to deal with the quandaries of life in a wacky small-town Irish family circa 1990.
5806,United States,Comedy,tvSeries,Strangers with Candy,22.0,1999,6293,8.1,A 46-year-old ex-drug addict returns to high school as a freshman.
5828,United Kingdom,Comedy,tvSeries,8 Out of 10 Cats Does Countdown,30.0,2012,6194,8.2,A raunchy spoof edition of Countdown (1982) with the stars of 8 Out of 10 Cats (2005).
5836,United States,Comedy,tvSeries,The Bob Newhart Show,30.0,1972,6187,8.1,"The professional and personal misadventures of a psychologist and his family, patients, friends and colleagues."
5837,United Kingdom,Drama,tvSeries,The Forsyte Saga,276.0,2002,6184,8.1,"Chronicles the lives of three generations of the upper-middle-class British family, the Forsytes, from the 1870s to 1920."
5859,United States,Comedy,tvSeries,Review,30.0,2014,6135,8.4,"In this spoof of review shows, Forrest MacNeil, a critic obsessed with his work, experiences whatever the viewers ask him to review including divorce, anonymous sex, and all manner of criminal activity."
5861,United Kingdom,Drama,tvSeries,The Virtues,47.0,2019,6117,8.2,"Falling into despair after his nine-year-old son leaves for Australia with his ex, Joseph walks away from his present life and boards a boat for Ireland to confront painful memories from his childhood."
5866,United States,Comedy,tvSeries,Tacoma FD,30.0,2019,6097,8.1,Comedic look at firefighters battling their own boredom.
5870,United Kingdom,Comedy,tvSeries,Flowers,30.0,2016,6091,8.1,Dark comedy about the eccentric members of the Flowers family. Maurice and Deborah are barely together but yet to divorce. They live with Maurice's batty mother and their maladjusted twin children.
5897,United States,Drama,tvSeries,Good Girls Revolt,55.0,2015,6027,8.1,A look at the personal and professional lives of employees at an American news magazine in the late 1960s.
5903,United States,Comedy,tvSeries,The Soup,25.0,2004,6011,8.2,"From the hottest new series to the latest OMG reality TV moments, catch up on everything you missed through the lens of a sharp and hilarious commentary."
5913,United Kingdom,Comedy,tvSeries,How Not to Live Your Life,28.0,2007,5982,8.3,"Don Danbury, who slobs around, doesn't take his job seriously, and making awkward situations, has inherited a house from his late grandmother which she left in debt along with her carer, ...                 »
"
5930,United States,Comedy,tvSeries,Brockmire,30.0,2017,5936,8.0,"A famed Major League Baseball announcer who suffers an embarrassing, very public meltdown live on-air after discovering his beloved wife's serial infidelity, decides to reclaim his career and love life in a small town a decade later."
5950,United States,Comedy,tvSeries,I'm Sorry,30.0,2017,5872,8.0,"A seemingly-confident comedy writer, wife and mom comically exposes her inner immaturity and neuroses through unexpected life situations."
5953,United States,Drama,tvSeries,"North and South, Book II",570.0,1986,5870,8.0,The story of two friends and their families on opposite sides of the American Civil War.
5973,United States,Comedy,tvSeries,Salute Your Shorts,30.0,1991,5806,8.3,"A group of kids at a summer camp, run by the heard-but-never-seen Dr. Kahn, form friendships as they spend time harassing buffoonish camp counselor Kevin ""Ug"" Lee."
5980,United States,Comedy,tvSeries,The Honeymooners,30.0,1955,5782,8.6,A bus driver and his sewer worker friend struggle to strike it rich while their wives look on with weary patience.
4492,United States,Drama,tvSeries,Kings,60.0,2009,8587,8.1,"A modern day, alternate-reality drama about a hero who rises to become the King of his nation, based on the biblical story of King David."
