dataId,region,genre,contentType,title,length,releaseYear,votes,rating,description
12368,Japan,Animation,tvSeries,Seinto Seiya: The Lost Canvas - Meio Shinwa,24.0,2009,2039,8.1,"Story of the Holy War taking place in the 18th century, 250 years before the original Saint Seiya series. It centers on the fight between Tenma, one of the 88 Saints following Athena, and Alone, the reincarnation of the God Hades."
12371,United States,Documentary,tvSeries,Cinemassacre's Monster Madness,-1.0,2007,2038,8.8,"Every October, James Rolfe reviews horror movies, whether it be the old-school silent-era monster classics, the golden-age Universal horror films from the '30s, '40s and '50s, the grotesque...                 »
"
12383,United States,Documentary,tvSeries,American Horror Story FreakShow: Extra-Ordinary-Artists,4.0,2014,2031,8.0,"Behind the scenes with the ''Freaks'' of American Horror Story as they tell their life stories, what they have gone through, and how it has impacted them. It's an inspiration documentary ...                 »
"
12389,United States,Documentary,tvSeries,American Experience,120.0,1987,2029,8.6,A series showcasing documentaries on American history.
12397,United States,Documentary,tvSeries,Modern Marvels,60.0,1993,2024,8.1,"Fast-paced, fun and informative, Modern Marvels is The History Channel's signature series focusing on historical technology."
12403,Japan,Animation,tvSeries,Golden Kamuy,24.0,2018,2019,8.1,"In the early 20th century in Hokkaido, Japan, a treasure hunt between various parties takes place for a hidden stash of gold."
12404,United States,Documentary,tvSeries,100 Foot Wave,60.0,2021,2019,8.1,"Follows the decade-long odyssey of big-wave pioneer Garrett McNamara who, after visiting a small fishing village in Portugal, helped push the sport beyond the realm of imagination."
12413,United Kingdom,Documentary,tvSeries,All Watched Over by Machines of Loving Grace,60.0,2011,2014,8.3,"A series of films about how humans have been colonized by the machines we have built. Although we don't realize it, the way we see everything in the world today is through the eyes of the computers."
12422,Japan,Animation,tvSeries,Black Butler: Book of Circus,-1.0,2014,2005,8.2,"Ciel Phantomhive, the queen's watch dog, is given two tickets to go to a traveling circus for himself and his demon butler, Sebastian Michaelis. His job is to enter the circus and look for ...                 »
"
12427,United States,Animation,tvSeries,G.I. Joe: A Real American Hero - The M.A.S.S. Device,300.0,1983,2002,8.0,The GI Joe Special Missions force must battle to build a counterweapon to Cobra's teleportation device.
12428,United States,Documentary,tvSeries,When We Left Earth: The NASA Missions,48.0,2008,2002,8.8,"Narrated by award-winning actor Gary Sinise, WHEN WE LEFT EARTH is the incredible story of humankind's greatest adventure, as it happened, told by the people who were there. From the early ...                 »
"
12443,United Kingdom,Documentary,tvSeries,The Green Planet,59.0,2022,1995,9.1,"Dive into a world where a single life can last a thousand years, with David Attenborough. See things no eye has ever seen, and discover the dramatic, beautiful plant life of Earth."
12455,India,Drama,tvSeries,Kaisi Yeh Yaariyan,30.0,2014,1984,8.0,"Manik and Nandini's love story is the stuff fairy tales are made of. Together, they promised each other a world full of lights. But where light exists, shadows too appear. Can their love ...                 »
"
12463,United States,Animation,tvSeries,Mad Jack the Pirate,30.0,1998,1977,8.6,"Series about a luckless pirate and his anthropomorphic rat sidekick, Snuk."
12464,United Kingdom,Drama,tvSeries,Anne,53.0,2022,1976,8.1,The story of Anne Williams' fight for the truth of her son's death.
12470,United States,Documentary,tvSeries,Luke Bryan: My Dirt Road Diary,-1.0,2021,1975,8.6,"Multi-platinum country music superstar and recent Academy of Country Music Awards ""Entertainer of the Year"" recipient, Luke Bryan, as he experiences the ups, downs, triumphs and tragedies along the road to unprecedented success."
12474,India,Drama,tvSeries,Yeh Un Dinon Ki Baat Hai,20.0,2017,1973,8.4,The story chronicles the adolescent romance between Naina and Sameer and explores the magic of 'first love' set in the city of Ahmedabad in the year 1990.
11491,United Kingdom,Documentary,tvSeries,Life Story,60.0,2014,2250,9.0,David Attenbourough narrates on the greatest of all adventures - the journey through life.
11496,Canada,Documentary,tvSeries,Departures,46.0,2008,2247,8.9,"Aimed at the adventure seeker, Departures is an action-packed and personal journey about two travelers. Scott Wilson and Justin Lukach leave their lives behind in search of unique ...                 »
"
11497,United States,Documentary,tvSeries,The Elegant Universe,60.0,2003,2245,8.2,A documentary examining string theory.
11498,Japan,Animation,tvSeries,Kenichi: The Mightiest Disciple,25.0,2006,2244,8.1,"""Weak Legs"" Kenichi Shirahama would rather spend his time reading self improvement books than fighting."
11614,United States,Documentary,movie,Hoop Dreams,170.0,1994,26966,8.3,A film following the lives of two inner-city Chicago boys who struggle to become college basketball players on the road to going professional.
11678,United States,Drama,movie,A Woman Under the Influence,155.0,1974,26348,8.1,"Although wife and mother Mabel is loved by her husband Nick, her mental illness places a strain on the marriage."
11694,United States,Documentary,movie,Won't You Be My Neighbor?,95.0,2018,26225,8.3,"An exploration of the life, lessons, and legacy of iconic children's television host Fred Rogers."
11705,United States,Documentary,movie,Apollo 11,93.0,2019,26130,8.1,A look at the Apollo 11 mission to land on the moon led by commander Neil Armstrong and pilots Buzz Aldrin and Mike Collins.
11759,Japan,Drama,tvSeries,Hanzawa Naoki,54.0,2013,2237,8.4,"An idealistic banker takes on corruption and wrongdoing at his corporate bank. He must use his financial expertise, his instincts about human nature, and his skills of improvisation to try to stay one step ahead of his powerful enemies."
11790,United Kingdom,Documentary,tvSeries,Walking with Monsters,87.0,2005,2220,8.2,"The final installment in the ""Walking with"" series is a 90-minute documentary about the evolution of life before the dinosaurs."
11802,United Kingdom,Documentary,tvSeries,I Shouldn't Be Alive,60.0,2005,2209,8.1,"Re-enactments of real-life tales of human survival against the savage elements, dangerous climates and physical hazards."
11812,Japan,Animation,tvSeries,Natsume's Book of Friends,24.0,2008,2201,8.1,When Natsume Takashi inherits a book that belonged to his late grandmother he realizes the book is filled with the names of spirits she defeated and bound to her will. He then decides to return their names so they can be free once again.
11813,United Kingdom,Documentary,tvSeries,Full Swing,45.0,2023,2200,8.1,"Follows behind the scenes of what it takes to compete and win at the highest levels in men's professional golf, following the PGA players through their wins and losses."
11825,Japan,Animation,tvSeries,Super Dimension Fortress Macross,25.0,1982,2194,8.5,An alien spaceship crash lands on Earth and her secrets lead to a desperate war against an alien enemy sent to retrieve the ship.
11832,United Kingdom,Animation,tvSeries,Monkey Dust,29.0,2003,2189,8.5,A definitely-not-for-children animated series with each episode made up of an array of perverse skits.
11834,Japan,Drama,tvSeries,Liar Game,36.0,2007,2189,8.0,"Trusting, gullible Nao suddenly finds herself participating in the mysterious Liar Game, a game where the players are issued large sums of money which they then have to cheat each other out...                 »
"
11903,Japan,Animation,tvSeries,Hi Score Girl,25.0,2018,2147,8.0,The funny and romantic misadventures of a couple of kids passionate about arcade games in 1991 Japan.
11922,United Kingdom,Documentary,tvSeries,Take Us Home: Leeds United,42.0,2019,2138,8.0,"English football's 'fallen giant', Leeds United, starts a journey to win promotion back to the Premier League. New owner Andrea Radrizzani has recruited a world-class head coach, Marcelo Bielsa, to lead the team back to the promised land."
11934,United Kingdom,Documentary,tvSeries,Can't Get You Out of My Head,75.0,2021,2131,8.5,"Love, power, money, ghosts of empire, conspiracies, artificial intelligence and You. An emotional history of the modern world by Adam Curtis."
11948,Japan,Animation,tvSeries,Aoashi,24.0,2022,2124,8.1,"Ashito Aoi, who lives in Ehime prefecture. Ashito has a strong talent in soccer, but he tries to hide it. Due to his very straightforward personality, he causes a disaster that serves as a huge setback for him"
11951,United States,Animation,tvSeries,The Bugs Bunny/Road Runner Show,90.0,1978,2123,8.3,"The continuation of the old Bugs Bunny/Road Runner Hour that had bounced around between ABC, NBC, CBC, and CBS. This series became infamous for editing the violence out of the Warner ...                 »
"
11954,United Kingdom,Documentary,tvSeries,WWII in Color: Road to Victory,50.0,2021,2119,8.2,Gripping historical footage and expert commentary give detailed insights into the leading figures and decisive turning points of WWII.
11957,Japan,Animation,tvSeries,The Rose of Versailles,24.0,1979,2118,8.4,"The story of Lady Oscar, a female military commander who served during the time of the French Revolution."
11970,United States,Documentary,tvSeries,Frontline,60.0,1983,2108,8.6,Investigative journalist documentaries.
10999,United States,Drama,tvSeries,Jack & Bobby,60.0,2004,2407,8.0,"The early life of Bobby McCallister, a progressive President of the United States from 2041 to 2049, is explored."
11073,United States,Documentary,movie,What Is a Woman?,95.0,2022,29292,8.4,"Political commentator Matt Walsh explores the changing concepts of sex and gender in the digital age, particularly the transgender rights movement, anti-transgender bigotry, and what it means to be a woman."
11101,Japan,Drama,movie,Nobody Knows,141.0,2004,29060,8.0,"In a small Tokyo apartment, twelve-year-old Akira must care for his younger siblings after their mother leaves them and shows no sign of returning."
11121,India,Drama,movie,Masaan,109.0,2015,28919,8.1,"Along India's Ganges River, four people face prejudice, a strict moral code and a punishing caste system as they confront personal tragedies."
11205,United States,Documentary,movie,Before the Flood,96.0,2016,28222,8.2,"A look at how climate change affects our environment and what society can do to prevent the demise of endangered species, ecosystems and native communities across the planet."
11269,United States,Documentary,tvSeries,Men in Kilts: A Roadtrip with Sam and Graham,30.0,2021,2397,8.5,"Sam Heughan and Graham McTavish take viewers on a road-trip, discovering the rich and complex heritage of their native Scotland."
11277,India,Documentary,tvSeries,Alma Matters - Inside the IIT Dream,150.0,2021,2389,8.3,"In a ""nation of middle-class"" the IIT dream involves clearing the world's toughest public exam for guaranteed lifelong success. Life is not an exam though. It's a hustle, one that nobody trains them for. The result? Eternal tumult."
11291,United States,Documentary,tvSeries,History of Horror,42.0,2018,2376,8.0,An in-depth look at the history and pop cultural significance of horror films.
11317,United Kingdom,Documentary,tvSeries,Jazz,114.0,2001,2358,8.6,A survey of the musical form's history and major talents.
11327,United States,Documentary,tvSeries,Better Late Than Never,60.0,2016,2352,8.5,"This hilarious fish-out-of-water comedy/reality show follows cultural icons Henry Winkler, William Shatner, Terry Bradshaw and George Foreman on their greatest adventure yet. Deciding it's ...                 »
"
11337,United States,Animation,tvSeries,The Shivering Truth,11.0,2018,2345,8.1,"The Shivering Truth is a miniature propulsive omnibus clusterbomb of painfully-riotous daymares all dripping with the orange goo of dream logic. A series of loosely-linked emotional ...                 »
"
11380,United States,Documentary,tvSeries,Tiny World,30.0,2020,2313,8.9,A look at the world through the eyes of the tiniest creatures and witness the extraordinary things they do to survive.
11391,United States,Documentary,tvSeries,Outcry,300.0,2020,2307,8.2,"A five-part documentary series examining the gripping story of high school football star Greg Kelley who was arrested, convicted and jailed for sexual assault of a 4-year-old boy, and his supporters' quest for truth and justice."
11392,United States,Documentary,tvSeries,WWII in HD,60.0,2009,2307,8.7,"Follow the lives of soldiers who lived World War II, through previously unseen color footage."
11420,India,Drama,tvSeries,RadhaKrishn,60.0,2018,2286,8.0,"The story of Radha and Krishna is the epitome of eternal love, which transcends eras and emotions."
11427,United States,Animation,tvSeries,HarmonQuest,23.0,2016,2283,8.3,Dan Harmon and his celebrity friends get together to play a fantasy role playing game.
11438,Japan,Animation,tvSeries,Ghost Stories,24.0,2000,2278,8.0,A group of school kids and a possessed cat fight ghosts in their neighborhood.
11455,United States,Documentary,tvSeries,Hard Knocks,55.0,2001,2268,8.4,Hard Knocks is a reality sports documentary produced by the NFL and HBO. Each season the show follows an NFL team during training camp in preparation for the upcoming season.
11463,United States,Documentary,tvSeries,All or Nothing: A Season with the Arizona Cardinals,50.0,2016,2261,8.5,"For the first time in history, Amazon and NFL Films present an unprecedented inside look at the lives of players, coaches and owners of a franchise over the course of an entire NFL season. ...                 »
"
11470,Japan,Animation,tvSeries,UFO Robo Grendizer,26.0,1975,2259,8.4,"Escaping from Vega's evil forces, the young Prince of planet Fleed leaves his destroyed homeland aboard the UFO Robot Grendizer, a powerful war machine, and makes it to Earth. Rescued by a ...                 »
"
10492,United States,Documentary,tvSeries,The Last Narc,185.0,2020,2577,8.5,"Former cartel insiders divulge the bone-chilling details behind the notorious murder and kidnapping of DEA Agent ""Kiki"" Camarena."
10538,United States,Documentary,movie,Seaspiracy,89.0,2021,32098,8.1,"Passionate about ocean life, a filmmaker sets out to document the harm that humans do to marine species - and uncovers alarming global corruption."
10638,United States,Biography,movie,Inherit the Wind,128.0,1960,31116,8.1,"Based on a real-life case in 1925, two great lawyers argue the case for and against a Tennessee science teacher accused of the crime of teaching evolution."
10677,United States,Biography,movie,Temple Grandin,107.0,-1,30670,8.2,"A biopic of Temple Grandin, an autistic woman who has become one of the top scientists in the humane livestock handling industry."
10705,United States,Animation,movie,Piper,6.0,2016,30318,8.3,"A hungry sandpiper hatchling ventures from her nest for the first time to dig for food by the shoreline. The problem is, the food is buried in the sand where scary waves roll up."
10755,Canada,Documentary,tvSeries,Metal Evolution,-1.0,2011,2567,8.5,"Metal Evolution is broken down into episodes about a different piece of metal history. The series includes interviews with and about Alice Cooper, Slash, Lemmy, Rob Zombie, members of ...                 »
"
10793,United Kingdom,Drama,tvSeries,Our Mutual Friend,350.0,1998,2540,8.1,"Intertwining tales of love, greed, and secret identities in Charles Dickens's 1860s London."
10801,United States,Documentary,tvSeries,Light & Magic,357.0,2022,2536,8.8,"Showcasing the people of Industrial Light and Magic, the special effects division of Lucasfilm, this series takes us back in time as they create the effects for some of the biggest and most successful films of the last 45 years."
10808,Japan,Animation,tvSeries,When They Cry: Kai,25.0,2007,2532,8.1,"In this continuation of the hit horror anime, secrets are revealed as Rika Furude desperately attempts to save Hinamizawa and her friends from their tragic fate"
10821,Japan,Animation,tvSeries,Bakuman.,24.0,2010,2523,8.0,"Moritaka Mashiro, a junior high school student, content to live out a relatively normal life as any other does, is persuaded by his classmate, Akito Takagi, to become an aspiring mangaka ...                 »
"
10835,Japan,Animation,tvSeries,Beck: Mongolian Chop Squad,25.0,2004,2512,8.3,"Koyuki meets the guitarist, Ryuske, and discovers a love and talent for music."
10842,Japan,Animation,tvSeries,Mobile Suit Gundam 00,24.0,2007,2507,8.1,"In the distant future, mankind has used up all of its fossil fuels, forcing them to turn to Solar Power as an alternate energy source. As a result, this causes a rift to form between richer...                 »
"
10852,Japan,Animation,tvSeries,Fighting Spirit: Rising,20.0,2013,2503,8.7,"Ippo the Japanese Featherweight champion will defend his title against amazing challengers. Takamura fights for the second WBC title in the middleweight class, and Aoki fights for the Lightweight title."
10872,Japan,Animation,tvSeries,Mobile Suit Gundam,30.0,1979,2494,8.0,"In the war between the Earth Federation and Zeon, a young and inexperienced crew find themselves on a new spaceship. Their best hope of making it through the conflict is the Gundam, a giant humanoid robot, and its gifted teenage pilot."
10894,United States,Animation,tvSeries,Saber Rider and the Star Sheriffs,23.0,1987,2483,8.4,"In the distant future, a team of four high-tech Star Sheriffs defends frontier space colony Yuma from outlaws, as well as Outriders, an army of humanoid alien beings called Vapors, led by mysterious Nemesis, who need Yuma's resources."
10895,Japan,Animation,tvSeries,Mononoke,25.0,2007,2482,8.3,"A mysterious man called the Medicine Seller travels along feudal Japan, uncovering and slaying evil spirits called ""Mononoke""."
10910,United Kingdom,Documentary,tvSeries,Wild Pacific,353.0,2009,2471,8.7,"A documentary series on life in and adapted to the conditions of the Southern part of the Pacific Ocean, a vast aquatic region with an unequaled number of islands. Both wildlife and human ...                 »
"
10914,United Kingdom,Documentary,tvSeries,Screenwipe,30.0,2006,2469,8.8,Satirical TV show critique.
10917,United States,Documentary,tvSeries,Our Great National Parks,50.0,2022,2467,8.1,A five-part documentary series about the world's most breathtaking national parks and the wildlife that live there.
10927,United Kingdom,Drama,tvSeries,This Life,45.0,1996,2456,8.5,"A series following the lives of Miles, Milly, Warren, Egg and Anna, five young professionals."
10942,United States,Documentary,tvSeries,Lenox Hill,-1.0,2020,2450,8.7,"An intimate look at the lives of four doctors - two brain surgeons, an emergency room physician, and a Chief Resident OBGYN - as they navigate the highs and lows of working at the renowned Lenox Hill Hospital in New York City."
10950,United Kingdom,Drama,tvSeries,Warriors,175.0,1999,2448,8.2,After seeing devastating results of ethnic war in former Yugoslavia soldiers from UNPROFOR peace units find it impossible to return back to their civil lives in the UK.
10953,Japan,Animation,tvSeries,A Place Further Than the Universe,23.0,2018,2445,8.2,"Mari Tamaki is in her second year of high school and wants to start something. She meets Shirase, a girl with few friends who's considered weird by the rest of the class and nicknamed ""...                 »
"
10978,United States,Documentary,tvSeries,Sinatra: All or Nothing at All,240.0,2015,2423,8.0,"SINATRA: All or Nothing at All is an up-close and personal examination of the life, music and career of the legendary entertainer. Told in his own words from hours of archived interviews, ...                 »
"
9987,United States,Documentary,tvSeries,TIME: The Kalief Browder Story,258.0,2017,2772,8.5,"After his arrest at age 16, Kalief Browder fought the system and prevailed, despite unthinkable circumstances. He became an American hero."
10021,India,Drama,movie,The Tashkent Files,134.0,2019,34693,8.1,"Revolves around the mysterious death of India's 2nd Prime Minister Shri Lal Bahadur Shastri and attempts to uncover if he had actually died a natural death, or, as alleged, was assassinated."
10044,India,Drama,movie,Pather Panchali,125.0,1955,34427,8.3,"Impoverished priest Harihar Ray, dreaming of a better life for himself and his family, leaves his rural Bengal village in search of work."
10054,United States,Animation,movie,Rudolph the Red-Nosed Reindeer,47.0,-1,34276,8.0,"A young reindeer Rudolph lives at the North Pole. His father is one of Santa's reindeer and it is expected that Rudolph will eventually be one too. However, he has a feature which is a setback and causes him to be ostracized: his red nose."
10055,India,Drama,movie,Anand,122.0,1971,34276,8.1,"The story of a terminally ill man who wishes to live life to the fullest before the inevitable occurs, as told by his best friend."
10063,United States,Animation,movie,Paperman,7.0,2012,34243,8.2,An office worker meets the girl of his dreams and uses a fleet of paper airplanes to get her attention.
10161,United States,Drama,movie,Sweet Smell of Success,96.0,1957,33325,8.0,Powerful but unethical Broadway columnist J.J. Hunsecker coerces unscrupulous press agent Sidney Falco into breaking up his sister's romance with a jazz musician.
10203,United Kingdom,Documentary,movie,David Attenborough: A Life on Our Planet,83.0,2020,32871,8.9,One man has seen more of the natural world than any other. This unique feature documentary is his witness statement.
10216,United States,Animation,movie,For the Birds,3.0,2000,32786,8.0,A group of snooty birds roosting on a telephone wire get their just deserts when a goofy bird drops in.
10239,India,Drama,movie,96,158.0,2018,32592,8.5,Two high school sweethearts meet at a reunion after 22 years and reminisce about their past.
10267,India,Drama,tvSeries,Vitthal Teedi,185.0,2021,2753,9.1,Story of a gambler as he journeys from his village to a city.
10272,United Kingdom,Documentary,tvSeries,A Perfect Planet,245.0,2021,2751,9.0,"Perfect Planet analyzes, in five episodes, how the forces of nature, including the power of the Sun or even humans, drive and shape life on Earth."
10275,Japan,Animation,tvSeries,Fighting Spirit: New Challenger,-1.0,2009,2750,8.8,"Ippo continues to defend his title and training to reach his goal, Ichiro Miyata. While Takamura goes for the world, and faces the world champion, Brian Hawk. In what is to become his toughest fight so far."
10285,United States,Animation,tvSeries,The Weekenders,15.0,2000,2742,8.0,The humorous Friday through Sunday misadventures of four best friends.
10344,United States,Documentary,tvSeries,History of the Eagles,187.0,2013,2695,8.2,"The life and times of the super successful American soft-rock band, Eagles."
10350,United States,Animation,tvSeries,The Pirates of Dark Water,30.0,1991,2691,8.3,A young man learns that he is a Prince with an urgent quest to save his world by finding thirteen magical treasures of rule.
10358,Japan,Drama,tvSeries,1 Litre of Tears,48.0,2005,2686,8.7,"The story of a 15-year-old high school student, Ikeuchi Aya, who soon discovers she has an incurable disease that affects the cerebellum of the brain. Aya lived her life to the fullest until her death at 25."
10371,Japan,Animation,tvSeries,Monogatari Series: Second Season,25.0,2013,2674,8.6,"Walking to school one day Tsubasa Hanekawa encounters a huge white tiger apparition at a crossroads that talks to her. The next day her house burns down. Homeless, and not wanting to stay ...                 »
"
10404,Japan,Animation,tvSeries,"Rainbow: The Seven from Compound Two, Cell Six",30.0,2010,2650,8.3,"Set in 1955, the anime follows the story of seven teenagers locked in a reformatory, waiting for a ray of light in a daily hell of suffering and humiliation, focusing especially on how they faced the life once regained freedom."
10408,United States,Documentary,tvSeries,Mind Field,26.0,2017,2647,8.7,Join me on a journey into the mysterious depths of the human psyche as I investigate the strange and surprising terrain of the Mind Field.
10434,Japan,Drama,tvSeries,Midnight Diner,24.0,2009,2622,8.6,"Shinya Shokudo is a tv series from Japan since 2009. It tells many stories about ordinary people eat in shinya shokudo, which means a restaurant at midnight. This small restaurant opens from 12 in the evening to 7 in the morning."
10456,India,Drama,tvSeries,Chanakya,45.0,1990,2604,9.3,This is a historical saga of establishing the Mauryan Empire in India
9487,Japan,Animation,tvSeries,March Comes in Like a Lion,25.0,2016,2995,8.3,"A 17 year old socially awkward orphaned shogi player, dealing with adult problems like financial difficulties, loneliness, and depression."
9489,United Kingdom,Documentary,tvSeries,Travel Man: 48 Hours in...,24.0,2015,2994,8.2,"British comedian Richard Ayoade and a celebrity guest, usually from the comedy world, spend 48 hours in a popular city to discover the must see tourist attractions."
9494,Canada,Drama,tvSeries,Degrassi High,30.0,1987,2986,8.1,The lives and trials of students of a city high school.
9498,Japan,Animation,tvSeries,Mushi-Shi: Next Passage,24.0,2014,2981,8.8,"They existed long before anyone can remember. They are simple and strange in nature, not resembling any other plant or animal in this world. In ancient times, people revered these bizarre ...                 »
"
9541,United States,Drama,movie,Ace in the Hole,111.0,1951,37044,8.1,"A frustrated former big-city journalist now stuck working for an Albuquerque newspaper exploits a story about a man trapped in a cave to rekindle his career, but the situation quickly escalates into an out-of-control circus."
