dataId,region,genre,contentType,title,length,releaseYear,votes,rating,description
31993,United Kingdom,Drama,tvSeries,The Beiderbecke Tapes,151.0,1987,351,8.5,"Trevor Chaplin teaches woodwork and likes to listen to jazz. Jill Swinburne teaches English and wants to help save the planet. They live together and just want a quiet life. Then they meet ...                 »
"
32008,United States,Documentary,movie,The Bee Gees: How Can You Mend a Broken Heart,111.0,2020,5105,8.1,"An exploration of the history of the Bee Gees, featuring revealing interviews with oldest brother Barry Gibb, and archival interviews with the late twin brothers Robin and Maurice."
32058,United States,Documentary,movie,Derek DelGaudio's In & Of Itself,90.0,2020,5081,8.2,Storyteller and Conceptual Magician Derek DelGaudio attempts to understand the illusory nature of identity and answer the deceptively simple question 'Who am I?'
32174,Japan,Drama,movie,Fires on the Plain,108.0,1959,5022,8.0,In the closing days of WWII remnants of the Japanese army in Leyte are abandoned by their command and face certain starvation.
32186,United States,Documentary,movie,Empire of Dreams: The Story of the 'Star Wars' Trilogy,151.0,-1,5015,8.2,"An in-depth making of documentary about the original Star Wars trilogy, covering the productions of the three films and their impact on popular culture."
32253,United Kingdom,Documentary,tvSeries,Chemistry: A Volatile History,60.0,2010,351,8.3,"Series in which Jim Al-Khalili traces the story of how the elements, the building blocks that make up our entire world, were discovered and mapped."
32270,United Kingdom,Documentary,tvSeries,The Sky at Night,20.0,1957,350,8.4,Astronomy programme.
32275,United States,Documentary,tvSeries,Savage Builds,60.0,2019,350,8.1,Host Adam Savage collaborates with notable experts to build some of the most ambitious projects in his career.
32276,United Kingdom,Documentary,tvSeries,Life and Death Row,-1.0,2014,350,8.3,A BBC documentary that follows the lives of three American citizens on death row.
32277,United States,Documentary,tvSeries,Death Row Chronicles,60.0,2018,350,8.1,"A six-part documentary that chronicles the rise and fall of one of the most iconic Hip-Hop recording labels ""Death Row Records"" in the 1990s and during the Golden Age of Hip-Hop."
32283,United States,Documentary,tvSeries,Accused: Guilty or Innocent?,-1.0,2020,349,8.2,"An intimate account of what happens when someone is formally charged with a crime and sent to trial as told by the perspective of the accused, their legal team and their family members."
32313,United Kingdom,Documentary,tvSeries,Escape to the Chateau DIY,-1.0,2018,348,8.1,"Many Brits have moved to France to buy crumbling French chateaus to renovate into stunning homes. This series follows their progress and sees them try to use their homes as a business for events, etc."
32336,United States,Animation,tvSeries,SG,-1.0,2000,348,8.4,The missions of a stylish pair of spies.
32356,United Kingdom,Documentary,tvSeries,Secrets of the Castle,60.0,2014,347,8.6,Historian Ruth Goodman and archaeologists Peter Ginn and Tom Pinfold learn about living in the medieval world and help rebuild a castle.
32360,India,Drama,tvSeries,Na Bole Tum Na Maine Kuch Kaha,-1.0,2012,347,8.1,A crime reporter and a widow with two children whose lives become intertwined.
32383,United States,Documentary,tvSeries,High Profits,42.0,2015,346,8.2,"Dreams of Empire. In Colorado a young couple set of with a dream to build the worlds first marijuana empire. This takes place on the eve of recreational marijuana open for anyone over 21 ...                 »
"
32384,United States,Animation,tvSeries,Sequelitis,-1.0,2011,346,8.1,"In Sequelitis, Egoraptor passionately discusses the relationships between video game sequels and their predecessors. He also cracks a lot of jokes which may or may not be funny."
32392,United States,Animation,tvSeries,Serie Pokemon XY,-1.0,2014,345,8.2,Ash and his Pikachu travel to the Kalos Region where he explores and battle Pokémon with new friends along the way.
32396,United Kingdom,Drama,tvSeries,Clouds of Witness,-1.0,1972,345,8.0,"Lord Peter's brother, the Duke of Denver is accused of murdering their sister Mary's fiancé. It's up to Lord Peter and his faithful man Bunter to untangle all the clues and the ...                 »
"
32415,United States,Documentary,tvSeries,BBS: The Documentary,296.0,2005,345,8.3,"Through eight episodes, director Jason Scott covers the 25 year history of the Dial-Up Bulletin Board System, a modem-connected computer system that let others connect to a computer over a ...                See full synopsis »
"
31457,United States,Documentary,tvSeries,The '90s: The Last Great Decade?,-1.0,2014,363,8.0,A show which highlights the events of the 90s.
31460,United Kingdom,Documentary,tvSeries,Wartime Farm,-1.0,2012,363,8.5,"Wartime Farm, is an eight-part British historical docuseries in which the running of a farm during the Second World War is reenacted. First broadcast on BBC Two on 6 September 2012."
31461,United Kingdom,Documentary,tvSeries,The 1900 House,60.0,1999,363,8.0,A modern English family embark on a real-life time-travel adventure to late Victorian London.
31469,United Kingdom,Biography,tvSeries,Oppenheimer,420.0,1980,362,8.2,"Biography of the American physicist who led the U.S. effort to develop the atomic bomb during World War II, only to find himself suspected as a security risk in the 1950s because of his ...                 »
"
31470,United Kingdom,Documentary,tvSeries,The Great War: 1914-1918,-1.0,1996,362,8.4,"A unique first-person narrative, sewn together from genuine testimonies of frontline soldiers."
31494,United Kingdom,Documentary,tvSeries,Great British Railway Journeys,30.0,2010,361,8.0,"Michael Portillo travels along the railway networks of Great Britain and Ireland, referring to a Victorian guidebook written by George Bradshaw as he describes how the destinations have changed."
31556,United Kingdom,Documentary,movie,Roger Waters: The Wall,132.0,2014,5205,8.5,Details one of the most elaborately staged theatrical productions in music history as Pink Floyd frontman Roger Waters performs the band's critically acclaimed album The Wall in its entirety.
31563,Japan,Animation,movie,Rascal Does Not Dream of a Dreaming Girl,89.0,2019,5200,8.1,A high school student's blissful days with his girlfriend are interrupted when his first crush returns in two forms.
31618,India,Drama,movie,Aparajito,138.0,2022,5176,8.8,This film is a tribute to master filmmaker Satyajit Ray in his birth centenary and it's inspired by the story behind the making of Ray's iconic film 'Pather Panchali'.
31672,United States,Documentary,movie,Cuba and the Cameraman,113.0,2017,5148,8.2,"Life in Cuba for three struggling families over the course of 45 years, from the cautious optimism of the early 1970s to the harrowing 1990s after the fall of the Soviet Union and the 2016 death of Fidel Castro."
31687,India,Drama,movie,Khushi,169.0,2001,5139,8.1,"While playing matchmaker to a pair of their friends, two young university students begin developing feelings for each other."
31709,United Kingdom,Documentary,movie,Pink Floyd: P. U. L. S. E. Live at Earls Court,145.0,-1,5128,9.2,Pink Floyd's final live show in 1995.
31719,United Kingdom,Drama,movie,The Browning Version,90.0,1951,5123,8.1,"Andrew Crocker-Harris (Michael Redgrave), a classics teacher at an English school, is afflicted with a heart ailment and an unfaithful wife (Jean Kent). His interest in his pupils wanes as he looks towards his final days in employment."
31767,United States,Documentary,tvSeries,The Center Seat: 55 Years of Star Trek,46.0,2021,360,8.5,"Chronicles rare and fascinating details of how ""Star Trek"" began, where it's been, and how it's going where no television series has gone before."
31788,United States,Documentary,tvSeries,First Person,491.0,2000,360,8.7,"Amazing series primarily using Errol Morris' invention the Interrotron for unusual people to tell their outré stories directly into the camera to the viewer. Almost every half-hour ...                 »
"
31818,United Kingdom,Documentary,tvSeries,Gordon Ramsay's Ultimate Cookery Course,-1.0,2012,359,8.2,"Gordon Ramsay goes one on one with the viewer to teach them step by step how to cook on a budget, bake like a pro, make tasty fast food and a 5 star feast."
31845,Japan,Animation,tvSeries,Mejaa,25.0,2004,358,8.1,"Honda Goro the son of a famous baseball player loves nothing more than baseball itself. His biggest dream is to show his father that he can become the best pitcher in the world despite all ...                 »
"
31888,United States,Biography,tvSeries,Eleanor and Franklin,203.0,1976,356,8.0,"The story of Franklin and Eleanor Roosevelt, from early youth to his election as President of the United States, as told from Eleanor's point of view."
31909,United Kingdom,Documentary,tvSeries,A History of Scotland,60.0,2008,355,8.2,A documentary charting the birth and growth of the Scottish nation.
31917,United Kingdom,Documentary,tvSeries,Coast,60.0,2005,355,8.1,The story of the coastline of the UK and her near neighbours.
31930,United States,Animation,tvSeries,Overwatch Shorts,10.0,2016,354,8.6,"The Overwatch Shorts are a collection of stories for the characters of the video game Overwatch. The in-game characters portrayed so far in these stories are Winston, Reaper, Widowmaker, ...                 »
"
30983,United States,Documentary,tvSeries,Broadway: The American Musical,360.0,2004,374,8.8,A six-part documentary about the Broadway musical
30984,United Kingdom,Documentary,tvSeries,Order & Disorder,60.0,2012,374,8.4,"Professor Jim Al-Khalili unwraps the evolutionary histories responsible for the modern human condition, as currently represented by our sophistication in energy manipulation and information technology."
30988,United States,Documentary,tvSeries,Cowboy Bebop: The Movie - Featurettes,42.0,2003,374,8.2,A series of interviews included on the US and Europe DVD releases of 'Cowboy Bebop: The Movie'.
31137,United States,Documentary,movie,John Wick: Kill Count,3.0,-1,5291,8.0,This piece recaps all of the kills in the film.
31187,United Kingdom,Documentary,movie,One More Time with Feeling,113.0,2016,5265,8.2,Explores the creative process of Nick Cave and his band as the singer struggles with an unspoken personal tragedy.
31250,United Kingdom,Documentary,tvSeries,Tudor Monastery Farm,59.0,2013,373,8.6,Historian Ruth Goodman and archaeologists Peter Ginn and Tom Pinfold turn the clock back 500 years to the early Tudor period to become tenant farmers on monastery land.
31267,United Kingdom,Documentary,tvSeries,The Story of China,59.0,2016,372,8.0,"Michael Wood embarks on a great historical adventure, exploring the stories, people and landscapes that have helped create China's distinctive character and genius over four thousand years."
31278,India,Drama,tvSeries,The 'Other' Love Story,-1.0,2016,371,8.7,"The 'other' love story is a journey of 2 young girls who fall in love and they act on it without thinking twice There is a lot of stigma associated with such a relationship, but inside the heart, only love endures."
31280,United Kingdom,Documentary,tvSeries,Great Continental Railway Journeys,60.0,2012,371,8.2,Michael Portillo travels across the European continent with his handy Bradshaw guide book. Looking at history and trying 21st century things that changed since before The Great War...
31287,United Kingdom,Drama,tvSeries,The Monocled Mutineer,310.0,1986,371,8.2,"During World War I, Percy Toplis, a deserter from the British Army, plays a major role in the Étaples Mutiny in September 1917."
31313,United States,Documentary,tvSeries,Cancer: The Emperor of All Maladies,345.0,2015,370,8.4,"Based on the Pulitzer Prize-winning book by Siddhartha Mukherjee, this three-part series tells the complete story of cancer, from its first description in an ancient Egyptian scroll to the ...                 »
"
31333,United Kingdom,Documentary,tvSeries,Ross Kemp in Afghanistan,-1.0,2008,369,8.2,"In the summer of 2007 Ross joins his father's old regiment, 1 Royal Anglian and, for the first time, heads to Afghanistan. Ross is immediately embedded with frontline troops where for weeks...                 »
"
31351,United States,Documentary,tvSeries,Power On: The Story of Xbox,40.0,2021,368,8.0,"Xbox almost didn't happen. Find out why in this behind-the-scenes, six-part series that takes you back to the scrappy beginnings of Microsoft's video game console. It's the untold story of the people behind the box, glitches and all."
31380,United States,Documentary,tvSeries,Huang's World,60.0,2013,367,8.0,"The real life Eddie Huang that is depicted in the family comedy from ABC's ""Fresh Off the Boat"" travels internationally giving tips, recommendations, and culture norms of different countries."
31392,United States,Documentary,tvSeries,Unsung,60.0,2008,366,9.0,"A series that profiles some of the most influential, talented yet forgotten R&B, Soul and Gospel artists of the 1970s, '80s and '90s."
31426,United States,Animation,tvSeries,Crashbox,25.0,1999,364,8.5,Educational games show for kids.
30452,United Kingdom,Documentary,tvSeries,Magic of Disney's Animal Kingdom,40.0,2020,386,8.3,"A documentary series which takes viewers behind the scenes with the animal-care experts, veterinarians, and biologists at Disney's Animal Kingdom and Epcot's SeaBase aquarium."
30472,United States,Documentary,tvSeries,Body Cam,60.0,2018,385,8.1,Body Cam features the actual footage of the daily activities of law enforcement officers throughout the country. The video is combined with firsthand accounts to provide insight into the dangerous situations that officers encounter daily.
30473,United States,Documentary,tvSeries,Super/Natural,44.0,2022,385,8.7,"Using the latest scientific innovations and filmmaking technology, the powers and super-senses of the world's animals will be revealed, inviting viewers to experience the natural world as a specific species does."
30511,Canada,Documentary,movie,Iron Maiden: Flight 666,112.0,2009,5526,8.3,"A chronological account of the heavy metal band Iron Maiden's 2008 world tour through India, Australia, Japan, USA, Canada, Mexico and South America in a jet piloted by the band's front man, Bruce Dickinson. Features interviews with the musicians, their road crew and fans."
30553,India,Biography,movie,Ennu Ninte Moideen,166.0,2015,5499,8.0,"Based on the real-life love story of Moideen and Kanchanamala, which happened in the 1960s in the backdrop of Calicut."
30592,Japan,Biography,movie,Hachi-ko,107.0,1987,5474,8.0,"The true story about a dog's loyalty to its master, even after his death."
30602,United States,Documentary,movie,Richard Pryor: Live in Concert,78.0,-1,5471,8.0,"Richard Pryor's classic 1979 concert film has him discussing a wide range of topics, including race, the police and his favorite target -- himself."
30668,United States,Animation,movie,Save Ralph,4.0,2021,5428,8.4,"Ralph, a bunny being interviewed for a documentary, goes through his daily routine as a ""tester"" in a lab."
30685,United Kingdom,Drama,movie,Oasis,60.0,-1,5418,8.0,A Scottish chaplain embarks on an epic journey through space.
30708,United States,Animation,movie,Rabbit of Seville,7.0,1950,5405,8.3,Bugs Bunny gives Elmer Fudd a close shave as they sing and act out Rossini's opera.
30721,United States,Documentary,movie,Chasing Coral,93.0,2017,5392,8.1,"Coral reefs around the world are vanishing at an unprecedented rate. A team of divers, photographers and scientists set out on a thrilling ocean adventure to discover why and to reveal the underwater mystery to the world."
30798,United States,Documentary,tvSeries,Weediquette,-1.0,2016,382,8.0,"This documentary series airing on Viceland is about the science, culture and economics of the legalization of cannabis. Also documents how medical marijuana has been a helpful and effective...                 »
"
30808,United States,Documentary,tvSeries,Dogs 101,60.0,2008,381,8.1,"Get to know all about individual dog breeds by their background, health, features, and more."
30831,United States,Documentary,tvSeries,Napoleon,240.0,2000,380,8.0,Documentary about the rise and fall of one of the greatest military geniuses of modern times from his Corsican childhood to final exile in St. Helena.
30874,Japan,Animation,tvSeries,Honey and Clover II,25.0,2006,379,8.1,"Honey and Clover II continues with the life of Takemoto, Yamada and Morita with each of them taking different paths and discovering themselves, story is narrated in voice of Takemoto just ...                 »
"
30911,United Kingdom,Documentary,tvSeries,Two Greedy Italians,60.0,2011,377,8.9,"Add a Plot
"
30937,United Kingdom,Documentary,tvSeries,Great Canal Journeys,-1.0,2014,375,8.8,Timothy West and Prunella Scales travel across canals in both Britain and Europe.
29970,United States,Sport,tvSeries,Steve Austin's Broken Skull Sessions,-1.0,2019,398,8.5,Stone Cold Steve Austin interviews WWE Superstars and legends.
30022,India,Drama,movie,The Conversion,134.0,2022,5654,8.5,"A Movie that explores the sensitive topic of religious conversion, this movie is a captivating drama depicting girl's dilemma of what happens in an inter-faith marriage that results in religious conversion."
30040,Japan,Animation,movie,Attack on Titan: The Roar of Awakening,120.0,2018,5644,8.4,"Eren Yeager and others of the 104th Training Corps have just become full members of the Survey Corps. As they ready themselves to face the Titans once again, their preparations are interrupted by the invasion of Wall Rose."
30161,United Kingdom,Documentary,movie,Sir Alex Ferguson: Never Give In,108.0,2021,5583,8.2,A look at the life and legend of Manchester United manager Alex Ferguson.
30236,United States,Documentary,movie,Chris Rock: Never Scared,80.0,-1,5540,8.0,"Are you ready for Rock? Actor/director/comedian Chris Rock performs a gut-busting set in his fourth HBO stand-up special taped before a live audience at Constitution Hall in Washington, D.C."
30264,India,Biography,tvSeries,Buddha: Rajaon Ka Raja,58.0,2013,396,8.8,"This series is a biography of Siddharta Gautama, the great Indian sage and founder of Buddhism."
30311,United Kingdom,Documentary,tvSeries,Going Tribal,-1.0,2005,394,8.7,Bruce Parry experiences first hand the day-to-day lives of tribal cultures around the world.
30329,Japan,Animation,tvSeries,Plastic Model Wrestling Sanshiro,30.0,1983,393,8.7,A young boy named Sanshiro Sugata battles against other PlaWrestlers using his miniature PlaWrestler pocket robot named Juohmaru.
30332,United States,Documentary,tvSeries,The Smash Brothers,258.0,2013,393,8.2,"A brief history of a subculture dedicated to competitively playing the video game ""Super Smash Bros. Melee""."
30379,United Kingdom,Animation,tvSeries,The Dreamstone,25.0,1990,390,8.0,"Somewhere in the universe is a planet only visible to those who believe in it. On the sunny side lives the Old Dreammaker, guardian of the most precious and powerful thing in the world - ...                 »
"
30401,United States,Documentary,tvSeries,Fight Science,-1.0,2006,389,8.2,"Infrared cameras, sensors and computerized test dummies allow engineers to exactly calculate the incredible physics and physiology that produce martial arts' devastating force-at last, separating myth from reality."
30406,United States,Documentary,tvSeries,Der Fisch in uns,-1.0,2014,389,8.7,"Have you ever wondered why the human body looks the way it does? Why we walk on two legs instead of four? Why we can see in color but have a lousy sense of smell? Your Inner Fish delves ...                 »
"
30423,United States,Animation,tvSeries,Grimm's Fairy Tale Classics,30.0,1987,388,8.5,An animated series retelling a different folk or fairy tale in each episode.
29455,United States,Documentary,tvSeries,The Kings,-1.0,2021,412,8.1,"A four-part series featuring four champions who ushered in a boxing renaissance. The series showcases the dominance of Roberto Duran, Marvelous Marvin Hagler, Thomas Hearns and Sugar Ray Leonard and their battles in and out of the ring."
29568,Japan,Drama,movie,The Naked Island,96.0,1960,5787,8.1,"A family of four are the sole inhabitants of a small island, where they struggle each day to irrigate their crops."
29648,United States,Documentary,movie,Disclosure,108.0,2020,5726,8.2,An in-depth look at Hollywood's depiction of transgender people and the impact of those stories on transgender lives and American culture.
29713,India,Drama,movie,A Northern Story of Valor,168.0,1989,5689,8.7,The film offers an alternative version of the fight between two legendary Chekavars from Chanthu's perspective.
29750,United Kingdom,Documentary,tvSeries,The First Eden,-1.0,1987,410,8.0,Sir David Attenborough reviews the history of mankind's relationship with the natural world in the lands around the Mediterranean.
29805,United Kingdom,Drama,tvSeries,Married Single Other,-1.0,2010,407,8.0,A story of several people living in England not all are related however all are closely intertwined with each other. This programme highlights personal problems and challenges that need be overcome by people of different ages.
29845,United Kingdom,Documentary,tvSeries,Two Fat Ladies,30.0,1996,405,8.5,Clarissa and Jennifer are two long-time friends who enjoy driving on their motorcycle and cooking ethnic foods according to where they live.
29855,United Kingdom,Documentary,tvSeries,Moon Machines,-1.0,2008,405,8.8,"A collection of documentaries about project apollo,from the designers and engineers viewpoint.Each episode focused on individual components or equipment for the Apollo programme."
29872,United Kingdom,Documentary,tvSeries,"Putin, Russia and the West",60.0,2011,404,8.1,Four-part documentary exploring how Russia has been resurrected by Vladimir Putin.
29877,United States,Sport,tvSeries,New Japan Pro Wrestling,-1.0,2015,404,8.6,"A hard hitting, fast paced, strong style alternative to professional wrestling. The stars of New Japan show up - to show off."
29879,United Kingdom,Documentary,tvSeries,Wild Africa,300.0,2001,404,8.0,"Wild Africa is a nature documentary series exploring the natural history of the African continent. The series comprises six episodes. Each concentrates on a particular environment. The ...                 »
"
29903,Canada,Sport,tvSeries,Hockey Night in Canada,-1.0,1952,403,9.4,The premiere Canadian prime time NHL ice hockey telecast program.
29921,India,Drama,tvSeries,Tamas,297.0,1988,402,8.9,"This TV miniseries (""Darkness"" in English) became famous in India in the mid/late 80s for its realistic depiction of the partition of the Indian subcontinent. In 1947, the sub continent ...                 »
"
29935,United States,Documentary,tvSeries,Moguls & Movie Stars: A History of Hollywood,-1.0,2010,401,8.6,The history of Hollywood film from the medium's invention to the birth of the New Hollywood in 1970.
29937,United States,Documentary,tvSeries,How We Got to Now,360.0,2014,401,8.4,Explores the power and the legacy of great ideas.
28943,United States,Documentary,tvSeries,America in Color,60.0,2017,427,8.3,America in Color showcases all the key moments from the 1920's to 1960's in high definition improved footage.
28959,United Kingdom,Drama,tvSeries,Mother Love,220.0,1989,426,8.4,"A British yuppie couple have a seemingly idyllic existence. But there is one troubling factor in their lives - the husband's eccentric and sometimes difficult mother. Her odd behavior ...                 »
"
28965,United Kingdom,Documentary,tvSeries,The Atheism Tapes,-1.0,2004,426,8.1,Jonathan Miller interviews five atheists and one theologian on the subject of atheism.
28966,United States,Documentary,tvSeries,Inside Look: Feud - Bette and Joan,4.0,2017,426,8.6,An inside look at the making of Feud: Bette and Joan.
28968,United States,Documentary,tvSeries,Mutual of Omaha's Wild Kingdom,30.0,1963,425,8.5,Host Marlin Perkins explores various animals in their natural habitats.
28980,United States,Documentary,tvSeries,Expedition: Back to the Future,174.0,2021,424,8.2,"Josh Gates and Christopher Lloyd set out an epic journey in search of the iconic DeLeorean Time Machine from the ""Back to the Future"" trilogy of movies, hoping to deliver it to The Michael J. Fox Foundation."
28990,United Kingdom,Drama,tvSeries,One Summer,300.0,1983,424,8.3,"Two teenagers, Icky and Billy, grow tired of their life in Liverpool and decide to run away to North Wales. But it's not long before their past catches up with them."
28992,United States,Animation,tvSeries,Fish Police,30.0,1992,424,8.0,"Inspector Gill, a fish detective, navigates an underwater metropolis, solving often Mafia-related crimes while avoiding the seduction of vamp Angel Jones and avoiding marriage to diner owner Pearl."
29003,United States,Documentary,movie,Valley Uprising,103.0,2014,5997,8.1,"In the shady campgrounds of Yosemite valley, climbers carved out a counterculture lifestyle of dumpster-diving and wild parties that clashed with the conservative values of the National Park Service."
29039,United States,Documentary,movie,Vikings Season 3: Heavy Is the Head -the Politics of King Ragnar's Rule,-1.0,-1,5970,9.0,"Add a Plot
"
29160,Canada,Animation,movie,The Man Who Planted Trees,30.0,1987,5888,8.5,The story of a shepherd's single handed quest to re-forest a barren valley.
29199,United States,Animation,movie,One Froggy Evening,7.0,1955,5864,8.4,"A man futilely struggles to make his fortune with a frog that sings and dances, but only when it is alone with the owner."
29212,India,Drama,movie,Colour Photo,140.0,2020,5856,8.2,A tragic-comedy that is set in the 90s between two different personalities coming from different backgrounds that change their lives in a tale of love.
