dataId,region,genre,contentType,title,length,releaseYear,votes,rating,description
55180,India,Drama,movie,Poster,143.0,2021,2058,8.0,"Poster is a Telugu Love Drama and Family Entertainment. Story drive's like ""Without problems no human being is on earth it can be love, study, career or anything else. Suicide is not the ...                 »
"
55218,United Kingdom,Documentary,movie,Concert for George,146.0,-1,2053,8.6,"George Harrison's friends, family, and bandmates unite for a tribute concert on the one-year anniversary of his death."
55223,United States,Documentary,movie,Magic & Bird: A Courtship of Rivals,85.0,-1,2053,8.3,An exploration of the fierce rivalry between NBA superstars Larry Bird and Magic Johnson during their decade of dominance.
55272,India,Drama,movie,Saudi Vellakka,137.0,2022,2046,8.0,"Abhilash Sasidharan receives a summons warrant by the court for a long pending case. Desperate to find out the truth, he finds the real issue where a small conflict snowballed into a bigger one that changes the lives of everyone involved."
55284,United States,Documentary,movie,George Carlin: What Am I Doing in New Jersey?,61.0,-1,2046,8.1,"George Carlin changes his act by bringing politics into the act, but also talks about the People he can do without, Keeping People Alert, and Cars and Driving part 2."
55289,United States,Documentary,movie,Dangerous Days: Making Blade Runner,214.0,-1,2045,8.3,"The definitive three-and-a-half hour documentary about the troubled creation and enduring legacy of the science fiction classic Blade Runner (1982), culled from 80 interviews and hours of never-before-seen outtakes and lost footage."
55339,India,Drama,movie,Rallalo Neeru,105.0,2020,2040,8.4,"Neela cannot explain her past actions easily, but her blackmailer has his own demands. Her marriage gets into trouble, but there are bigger questions about love and identity."
55370,United States,Documentary,tvSeries,Carson on TCM,12.0,2013,118,9.0,"TCM presents extended clips of Johnny Carson's interviews on his long-running talk show The Tonight Show Starring Johnny Carson (1962), with introductory comments by Conan O'Brien."
55376,Canada,Drama,tvSeries,Chouchou,480.0,2022,117,8.2,"A 37-year-old teacher falls for the charms of a student 20 years younger, causing a family crisis and her brutal fall to prison."
54447,United States,Documentary,tvSeries,Growing Up Animal,52.0,2021,122,8.1,"Follows the story of baby animals from their time in the womb to their first steps towards independence, showing their characteristics and tenacity."
54452,United States,Documentary,tvSeries,It's a Miracle,-1.0,1998,122,8.6,True stories about miracles still exist.
54460,United Kingdom,Biography,tvSeries,Strange But True?,30.0,1993,122,8.1,Michael Aspel explores stories of the unexplained.
54529,United Kingdom,Documentary,tvSeries,Francesco's Mediterranean Voyage,30.0,2008,122,8.4,"A 12-part documentary about a sailing voyage from Venice to Istanbul with many interesting stops along the way, hosted by native Venetian, Francesco da Mosto. Francesco is a charming and ...                 »
"
54540,United States,Animation,tvSeries,Sonic for Hire,224.0,2011,121,8.3,"Sonic is decipted in the series as a man out of a job and has a lack-of-income. So, Tails decides that he should earn money by working for third-party video games."
54544,United States,Drama,tvSeries,The Life of Jesus Christ,-1.0,2011,121,8.8,"Jesus Christ goes from being born in a manger to being King of the Jews. Walk where he walked, see what He did, and be where He died. What made him more than just a man in some peoples eyes but an impostor in others'?"
54560,United States,Drama,tvSeries,Robert Montgomery Presents,60.0,1950,121,8.2,"Actor, Producer, and Director Robert Montgomery introduced each telecast, sometimes interviewing one of the stars, and sometimes appearing in the play."
54573,India,Drama,tvSeries,Metti Oli,22.0,2002,121,8.9,"The entire plot of Metti Oli is about the daily happenings of Chidambaram's five daughters. The father is very patient and always remains calm in whatever circumstances, be it happy or sad....                 »
"
54617,United States,Documentary,tvSeries,Food Tech,60.0,2010,121,8.0,Big fan of pancakes? Want to know if French fries are really French? Food Tech dishes up the stories behind your favorite foods.
54630,United States,Documentary,tvSeries,The Empire Files,30.0,2015,121,8.0,An independent documentary & interview series hosted by Abby Martin - reporting on war & inequality from the heart of Empire
54662,United States,Drama,tvSeries,Testimony of Two Men,360.0,1977,120,8.2,"Ambitious, post-Civil War costume drama spaning 36 years which intertwines several stories of lust, power, greed and murder in dealing with two former army field doctors and their passion for their work and women in their lives."
54664,United Kingdom,Documentary,tvSeries,Mystic Britain,-1.0,2019,120,8.4,Television and radio presenter Clive Anderson and anthropologist Mary-Ann Ochota explore the island's ancient places and rituals.
54691,United States,Documentary,movie,White Light/Black Rain: The Destruction of Hiroshima and Nagasaki,86.0,2007,2091,8.2,"Using extensive interviews with survivors and archival footage, an examination reveals the aftermath of the atomic bombing of Hiroshima and Nagasaki."
54735,United States,Documentary,movie,We Stand Alone Together,78.0,-1,2085,8.6,"Compiled over two years, an 'on-camera oral history' of Easy Company, told by the veterans themselves. Accompanies the mini-series Band of Brothers."
54756,United States,Documentary,movie,The Up in Smoke Tour,119.0,-1,2082,8.5,"This is it! Your front row seat to the greatest hip hop experience ever captured on film. This is the ultimate back stage pass for your total pleasure. ""Up In Smoke"" is it and now you've got it all. Fire it up."
54774,India,Drama,movie,Maro Prapancham,109.0,2023,2080,8.5,"There are many mysteries in this whole universe that are beyond the comprehension and beyond the imagination of the human brain. One of them is Parallel universe concept"". The story is ...                 »
"
54779,India,Drama,movie,Mr. Kalyan,-1.0,2023,2079,8.7,"Add a Plot
"
54873,United States,Animation,movie,Garfield in Disguise,25.0,-1,2067,8.1,"When Garfield and Odie are out trick-or-treating, they end up at a haunted house."
53893,India,Documentary,movie,Secrets of Sinauli,56.0,2021,2138,9.0,The excavations of Sinauli have uncovered secrets that were buried for 4000 years.
53931,India,Drama,movie,Natarang,127.0,2010,2131,8.5,A poor working man loses his job and decides to start a theater troupe.
53940,United States,Drama,movie,An Early Frost,95.0,-1,2130,8.0,A young lawyer hasn't told his parents about his homosexuality. Now he must tell them--at a time when the diagnosis was still a death sentence--that he has AIDS.
53971,India,Drama,movie,Do Bigha Zamin,131.0,1953,2127,8.3,"In the hope of earning enough money to pay off his debts and save his land, a poor farmer becomes a rickshaw puller in Calcutta and faces many difficulties."
53983,India,Animation,tvSeries,Lamput,2.0,2017,124,8.5,"A clever orange nutcase, Lamput, escapes from a hidden laboratory, thus sending scientists Slim Doc and Fat Doc in a frenzy as they try hard to capture him. However, Lamput always manages to escape."
54025,United States,Documentary,tvSeries,HBO Boxing,63.0,1973,124,8.2,Telecasts of various boxing matches.
54028,United Kingdom,Documentary,tvSeries,Attenborough's Passion Projects,60.0,2016,124,8.3,"To honor their famous host and renown naturalist Sir David Attenborough's 90th birthday, the BBC has re-released David's four favorite programs from his extremely rich and influential career. He gives a short introduction to each of them."
54036,Japan,Drama,tvSeries,101st Marriage Proposal,-1.0,1991,124,8.2,"A young man has problems finding his true love. His brother tries to help him but is unsuccessful. It seems like this young man would be on the brink of major depression, until he meets a ...                 »
"
54068,United States,Documentary,tvSeries,Ravi Patel's Pursuit of Happiness,42.0,2020,124,8.1,Ravi Patel travels the world seeking answers to life's universal questions.
54071,United Kingdom,Documentary,tvSeries,Legacy: The Origins of Civilization,52.0,1991,124,8.0,"What can the past teach us about the present? Come along as charismatic historian Michael Wood (The Story of India) travels the globe to trace the origins of six great civilizations: Iraq, ...                 »
"
54074,United Kingdom,Documentary,tvSeries,Born in the USSR,-1.0,1991,124,8.6,Born in the USSR: Up follows the lives of people who grew up in the Soviet Union. They give an insight into Russian life.
54105,United Kingdom,Documentary,tvSeries,Surgeons: At the Edge of Life,180.0,2018,123,9.1,"Cameras follow surgeons, anaesthetists, theatre staff and patients at the Queen Elizabeth Hospital Birmingham's surgical unit, where surgeons push medical boundaries to the limit."
54110,United States,Animation,tvSeries,Battle for BFDI,-1.0,2017,123,8.8,A bunch of objects have to do challenges to win A BFDI.
54155,United Kingdom,Documentary,tvSeries,The Lion Ranger,45.0,2010,123,8.7,"An insight into the life and work of the famous lion whisperer, Kevin Richardson and his lion park which he struggles to keep running during a terrible drought in funding."
54172,United States,Documentary,tvSeries,Horror's Hallowed Grounds,45.0,2006,123,8.0,Host Sean Clark takes viewers around the world to revisit famous locations used in classic horror films.
54178,Japan,Animation,tvSeries,Manga Nippon Mukashi Banashi,30.0,1975,123,8.0,"Add a Plot
"
54235,United States,Animation,movie,Primal: Tales of Savagery,85.0,2019,2122,8.4,"GENNDY TARTAKOVSKY'S PRIMAL - TALES OF SAVAGERY features a caveman and a dinosaur on the brink of extinction. Bonded by tragedy, this unlikely friendship becomes the only hope of survival."
54257,United States,Documentary,movie,Batman & Bill,93.0,2017,2119,8.0,"Documentary about the uncredited co-creator of Batman, Bill Finger."
53504,Canada,Documentary,movie,"Inner Worlds, Outer Worlds",122.0,2012,2159,8.4,"There is one vibratory field that connects all things. It has been called Akasha, Logos, the primordial OM, the music of the spheres, the Higgs field, dark energy, and a thousand other names throughout history."
53523,India,Drama,movie,Thamasoma Jyothirgamaya,93.0,2021,2158,8.3,"Inspired by the true incidents, Kumar drops out of school after his fathers suicide and starts working for Chandraiah Setu, a loan shark, to support his family and repay his fathers loan. ...                 »
"
53533,United States,Documentary,tvSeries,NFL Films Presents,-1.0,1967,127,8.8,A look at the films produced by NFL Films that highlight the game of football and the legends of the game.
53535,Japan,Animation,tvSeries,Madô kingu Granzort,-1.0,1989,127,8.2,"Add a Plot
"
53543,United Kingdom,Documentary,tvSeries,Winston Churchill: The Valiant Years,30.0,1960,127,9.0,"Add a Plot
"
53578,United Kingdom,Documentary,tvSeries,The Great War: The People's Story,-1.0,2014,126,8.2,"Through original diaries, letters, and memoirs, this unforgettable documentary tells how the lives of regular British men and women were transformed by the Great War. Along with historical ...                 »
"
53607,Canada,Animation,tvSeries,Interface,-1.0,2017,126,8.5,"A sci-fi series following the characters Henryk and Mischief, the shapeshifting creature."
53614,United Kingdom,Documentary,tvSeries,Fred Dinenage Murder Casebook,-1.0,2011,126,8.1,"Fred Dinenage takes a fresh new look at the murders that shocked the United Kingdom in the 20th century, and the killers that committed them. Dinenage was not only the official biographer ...                 »
"
53617,United States,Sport,tvSeries,Home Run Derby,30.0,1959,126,8.6,"A series of filmed home run contests between two sluggers of the late 1950s/early 1960s, one National Leaguer, one American Leaguer. The batters had to swing at every pitch in the strike ...                 »
"
53634,United Kingdom,Documentary,tvSeries,Sacred Rivers with Simon Reeve,-1.0,2014,126,8.0,"This excellent mini series of 3 episodes visits a sacred River in each episode, Simon is really adept at presenting in a relaxed manner as he explains many of the traditions, difficulties and cultures along each River."
53635,Japan,Animation,tvSeries,Space Battleship Yamato II,30.0,1978,126,8.0,"A mysterious comet traveling to Earth's solar system is not what it seems. Without Captain Avatar, Derek Wildstar leads the Argo (Yamato) against a new enemy."
53637,United Kingdom,Documentary,tvSeries,Gods of Snooker,-1.0,2021,126,8.0,"For a remarkable period in the 80s, snooker became a national obsession, eclipsing even football. This is the story of the characters who turned the game into a soap opera, catapulting it from smoky halls to the public conscience."
53639,United States,Documentary,tvSeries,Basketball: A Love Story,-1.0,2018,126,8.5,"""Basketball: A Love Story"" is a series of more than 60 interconnected ""short stories"" that creates a vibrant mosaic of the game, featuring 165 exclusive interviews. The cast encompasses ...                 »
"
53643,United States,Documentary,tvSeries,Smarter Every Day,-1.0,2011,126,8.4,Destin explores the world using science.
53645,United Kingdom,Documentary,tvSeries,Burma with Simon Reeve,60.0,2018,126,8.0,"Simon travels to the biggest city in the Burma, Yangon to find out how the country is transforming. From there he drives north, into Burma's Buddhist heartlands and the stunning ancient ...                 »
"
53654,United Kingdom,Documentary,tvSeries,Adventures in Architecture,60.0,2008,126,8.0,"Historian and writer Dan Cruickshank celebrates architecture as a creative force as he explores the world's greatest cities, buildings and monuments."
53735,United Kingdom,Documentary,tvSeries,Future Fantastic,-1.0,1996,125,8.3,"A series of Science Fiction documentaries on a similar theme to the X-Files only true stories. Some of the topics include aliens, our planet, technology and UFO's."
53739,United Kingdom,Documentary,tvSeries,Journey of Life,300.0,2005,125,8.3,"The 5 x 60 minute programs cover the story of evolution, from the beginning of time to where we find ourselves today - the individual program titles being Seas Of Life, Land Grab, Airborne, Living Together and Human Life."
53770,India,Drama,movie,Dahnam,137.0,2022,2157,9.1,"A real Social Drama with most unexpected twists, Story Based on true events took place during 1980s in North Coastal AP."
53771,United States,Documentary,movie,Life of Crime 1984-2020,121.0,2021,2156,8.4,"A relentless ride through the streets and prisons of Newark, New Jersey's largest city, and desperate fight to survive the deadliest enemy ever to attack America."
53774,United Kingdom,Documentary,movie,India's Daughter,63.0,2015,2156,8.2,"The life and death of Jyoti Singh, an Indian medical student whose violation and murder by gang rapists exposed the violent misogyny of Indian society."
53801,United Kingdom,Documentary,movie,Charles Darwin and the Tree of Life,59.0,-1,2152,8.5,David Attenborough explores Charles Darwin's controversial theory of evolution by natural selection.
53802,United Kingdom,Documentary,movie,Eddie Izzard: Definite Article,109.0,-1,2152,8.3,"'Definite Article' marks that thrilling moment when a promising talent moves up several gears into major stardom""--Daily Telegraph, UK"
53827,India,Documentary,movie,An Insignificant Man,96.0,2016,2148,8.5,"A non-fiction drama chronicling the most outrageous political debut in the largest democracy in the world, ""An Insignificant Man"" follows Arvind Kejriwal and his insurgent party as they look to shake up Indian politics while struggling to keep their own idealism alive."
52900,United Kingdom,Documentary,movie,Iron Maiden: Rock in Rio,120.0,-1,2218,9.0,"Live concert on the back of 'Brave New World' album, showing why they're one of the greats, performing many hits from their long career, a band at its peak."
53096,United States,Documentary,tvSeries,Simply Ming,-1.0,2003,129,8.0,"Ming Tsai, former host of the Food Network's East Meets West, hosts a PBS cooking show."
53117,United Kingdom,Documentary,tvSeries,Moviedrome,5.0,1988,129,9.0,"Cult films receive interesting introductions from an expert, before the entire film is screened."
53126,Japan,Animation,tvSeries,Miimu iro iro yume no tabi,23.0,1983,129,8.3,"A little pink genie from a computer, helps two kids learn about important people and events from history by taking them to those times."
53137,United Kingdom,Documentary,tvSeries,Rough Science,-1.0,2000,129,8.9,"Series II went to the Caribbean, Series III to South Island, New Zealand."
53144,United Kingdom,Documentary,tvSeries,Beyond River Cottage,25.0,2004,129,8.2,Hugh Fearnley-Whittingstall and his growing family have moved on from River Cottage to a farm boasting 44 acres of land which offers the potential for producing far more livestock and vegetables than they need.
53195,Japan,Drama,tvSeries,Hitotsu yane no shita,54.0,1993,128,8.2,"A car accident killed a couple, orphaning their six children. At that time, the eldest child, Tatsuya, was only 18 and had to attend marathon training. Lacking the confidence to take good ...                 »
"
53204,United States,Documentary,tvSeries,The History of the Seattle Mariners,220.0,2020,128,8.8,"Every team has its highs and lows, frustration, heartbreak, greatness and confusion, but no other team is like this one. The Seattle Mariners are eminently lovable, profoundly human and stunningly, outrageously weird."
53266,India,Drama,tvSeries,Dil Dosti Dance,-1.0,2011,127,8.1,"A dance-based show that traces the journey of a college students and their passion for dance, as they wade through emotions around love and friendship."
53278,United States,Drama,tvSeries,Westinghouse Desilu Playhouse,60.0,1958,127,8.4,"An anthology series hosted by Betty Furness in the first season, and Desi Arnaz in the second. Stories came from several genres, often based on fact. A two part episode was spun off as the popular show The Untouchables (1959)."
53290,United States,Drama,tvSeries,The Great Adventure,60.0,1963,127,8.8,"A filmed series of one-hour dramatizations of the lives of famous historical people, as well as important historical events."
53315,India,Drama,movie,A: Film by Upendra,150.0,1998,2189,8.8,An unusual love story between a film director and an actress narrated through multiple flashbacks within flashbacks and reverse screenplay. The film deals with the dark truths of cinema like the casting couch.
53383,United States,Documentary,movie,Return to Source: Philosophy & The Matrix,61.0,-1,2178,8.1,"Add a Plot
"
52460,United Kingdom,Documentary,movie,McCullin,91.0,2012,2249,8.2,"To many, Don McCullin is the greatest living war photographer, often cited as an inspiration for today's photojournalists. For the first time, McCullin speaks candidly about his ...                 »
"
52527,United States,Documentary,movie,What's My Name: Muhammad Ali,165.0,2019,2238,8.4,"One of the most iconic figures in athletic history, Muhammad Ali's incredible story from world champion boxer to inspiring social activist is explored through his own voice and never-before-seen archival material."
52552,India,Drama,movie,Dollu,106.0,2022,2235,8.0,"It captures the struggle of Bhadra, a Dollu drummer and dancer who is trying to regroup his Dollu team to keep the age-old traditions alive. What will happen when urbanization affects this small village and its indigenous artform."
52645,United Kingdom,Documentary,tvSeries,Forensics: The Real CSI,59.0,2019,131,8.3,"Multiple cameras follow serious crime investigations in real time, revealing the crucial role cutting-edge forensic science now plays in bringing criminals to justice."
52664,United Kingdom,Documentary,tvSeries,Secrets of World War II,-1.0,1998,131,8.0,"Rarely has a war produced such clear cut reasons to fight as World War II. Suddenly, ordinary men and women found themselves thrown into fearsome, situations worthy of any Hollywood movie. ...                 »
"
52813,India,Drama,tvSeries,Gaaner Opare,30.0,2010,130,8.6,Two different Rabindra Sangeet singers finally fell in love.
52814,United Kingdom,Documentary,tvSeries,3 Minute Wonder,3.0,2003,130,8.1,"Add a Plot
"
51934,Canada,Drama,tvSeries,Marguerite Volant,-1.0,1996,134,8.1,"Nous sommes en 1763. Au terme d'une longue lutte, le roi Louis XV abandonne la Nouvelle-France aux mains des Britanniques par le biais du Traité de Paris. Marguerite Volant, vingt ans, ...                 »
"
51936,United Kingdom,Documentary,tvSeries,Italy Unpacked,-1.0,2013,134,8.4,"Andrew and Giorgio travel the length and breadth of Italy. Along the way, they visit the delights of the Italian scenery and pay hushed homage to the phenomenal art that comprises Italy's ...                 »
"
51952,United States,Documentary,tvSeries,The Inside Story,289.0,2021,134,8.5,"A look at the 30-year history of ""Inside the NBA,"" plus interviews with celebrities, crew members, sports reporters and more who illuminate the show's evolution into a cultural phenomenon."
51955,United States,Drama,tvSeries,Murder One: Diary of a Serial Killer,360.0,1997,134,8.2,Wyler and associates take on the case of an admitted serial killer.
51964,United States,Documentary,movie,Springsteen on Broadway,153.0,-1,2292,8.5,"The intimate, final performance of Bruce Springsteen's 236-show run at Jujamcyn's Walter Kerr Theatre on Broadway."
51999,United States,Documentary,movie,Powers of Ten,9.0,2016,2287,8.0,"Beginning with a shot of a couple enjoying a picnic, then zooming out incrementally by powers of ten, the film offers a glimpse of everything from the edge of the known universe to the molecules on a person's hand."
52009,United States,Documentary,movie,John Wick: Car Fu Ride-Along,5.0,-1,2285,8.0,"A look at the several Mustangs they used, which perhaps gives vintage car lovers hopes that some of them at least escaped without a scratch."
52100,India,Drama,movie,Sankarabharanam,143.0,1980,2271,8.9,"The story of a rare and exceptional bond between the master of classical music Sankara Sastry and his admirer Tulasi, a woman from a family of prostitutes."
52120,India,Drama,movie,Punjab 1984,159.0,2014,2268,8.3,"During a time of political turmoil, a mother goes on a journey in search of her missing son, who has been misjudged and labeled a terrorist."
52181,United States,Documentary,tvSeries,True Sight,-1.0,2016,134,8.9,True Sight is a documentary series that takes you into the backstage of the esports team competing at DotA tournaments.
52183,United Kingdom,Drama,tvSeries,Days of Hope,395.0,1975,134,8.0,A series of four films from the Great War to the General Strike.
52195,United Kingdom,Documentary,tvSeries,Lost Land of the Volcano,-1.0,2009,134,8.2,"A team of scientists search for new species of insets and animals to a island just north of Australia. This is a place where no one has been to known as the lost land, while on the there ...                 »
"
52200,United Kingdom,Documentary,tvSeries,The Men Who Made Us Fat,60.0,2012,134,8.2,In this 3 part documentary series Jacques Peretti looks at how marketing of food products changed the way we eat and led to a global junk food addiction and obesity epidemic.
52248,India,Animation,tvSeries,Meena,23.0,1991,133,8.6,Meena trys to eradicate misconceptions and superstitions from the society and create social awareness about different social phenomenas with occasional help from a wide variety of characters including her parrot companion Mithu.
52250,United States,Drama,tvSeries,Canary Currency,15.0,2020,133,9.3,After commiting a series of crimes with his brother Kram (Kcane Markco) Black_NRC (himself) finds himself between right and wrong. When he comes face to face with the law (James Wright) he has to make the decision of a lifetime
52261,United Kingdom,Documentary,tvSeries,Primates,58.0,2020,133,8.0,"Natural history documentary series filmed over two years, revealing the strategies monkeys, apes and lemurs use to survive in the most unexpected places."
52296,United States,Documentary,tvSeries,The Henry Ford Innovation Nation with Mo Rocca,-1.0,2014,132,8.1,Host Mo Rocca shares the dramatic stories of extraordinary inventors in hopes of inspiring viewers to open their imaginations and bring their visions to life.
52297,United States,Drama,tvSeries,En otra piel,-1.0,2014,132,8.0,"The plot begins with the story of two different woman: international piano player Monica Serrano and Adriana, a girl who works in a bar to pay her university tuition. Monica is just passing...                 »
"
52354,United Kingdom,Documentary,tvSeries,Richard Hammond's Miracles of Nature,-1.0,2012,132,8.4,"Richard Hammond reveals secret animal abilities from the natural world, and discovers how those same animals have inspired a series of unlikely human inventions at the very frontiers of science."
52358,United Kingdom,Documentary,tvSeries,Battle of the Atlantic,146.0,2002,132,8.0,The story of the World War II effort by Nazi Germany to disrupt Allied shipping with U-boat attacks and the Allied efforts to prevent it.
52372,United Kingdom,Documentary,tvSeries,The Bionic Vet,30.0,2010,132,8.8,"This documentary series follows a revolutionary neuro-orthopaedic veterinary surgeon, Dr. Noel Fitzpatrick, at his state-of-the-art practice in Surrey, England."
52389,India,Documentary,tvSeries,The Dewarists,40.0,2011,132,9.1,"The Dewarists is a new original series. Part music documentary and part travelogue, the show features inspiring musicians collaborating to create original music while traveling to locations across India."
